-- DATA

INSERT INTO tbl_deal_type (id, nazev) VALUES 	(1,'vklad')	;
INSERT INTO tbl_deal_type (id, nazev) VALUES 	(2,'vyber')	;
INSERT INTO tbl_deal_type (id, nazev) VALUES 	(3,'nakup')	;
INSERT INTO tbl_deal_type (id, nazev) VALUES 	(4,'prodej')	;
INSERT INTO tbl_deal_type (id, nazev) VALUES 	(5,'poplatek')	;

INSERT INTO tbl_product_type (id, nazev) VALUES 	(1,'Share')	;
INSERT INTO tbl_product_type (id, nazev) VALUES 	(2,'Bond')	;
INSERT INTO tbl_product_type (id, nazev) VALUES 	(3,'Currency')	;

INSERT INTO tbl_product (id, id_type, nazev, dt_issue,dt_maturity) VALUES 	(seq_product.nextval, 3, 'CZK',null,null)	;
INSERT INTO tbl_product (id, id_type, nazev, dt_issue,dt_maturity) VALUES 	(seq_product.nextval, 3, 'EUR',null,null)	;
INSERT INTO tbl_product (id, id_type, nazev, dt_issue,dt_maturity) VALUES 	(seq_product.nextval, 3, 'USD',null,null)	;

INSERT INTO tbl_product (id, id_type, nazev, dt_issue,dt_maturity) VALUES 	(seq_product.nextval,1,	'GEBERIT AG-REG'	,null,null)	;
INSERT INTO tbl_product (id, id_type, nazev, dt_issue,dt_maturity) VALUES 	(seq_product.nextval,1,	'NOBLE CORP. OLD 2013'	,null,null)	;
INSERT INTO tbl_product (id, id_type, nazev, dt_issue,dt_maturity) VALUES 	(seq_product.nextval,1,	'UBS AG - RTS'	,null,null)	;
INSERT INTO tbl_product (id, id_type, nazev, dt_issue,dt_maturity) VALUES 	(seq_product.nextval,1,	'NESTLE SA-REG'	,null,null)	;
INSERT INTO tbl_product (id, id_type, nazev, dt_issue,dt_maturity) VALUES 	(seq_product.nextval,1,	'UBS AG - RTS USD'	,null,null)	;
INSERT INTO tbl_product (id, id_type, nazev, dt_issue,dt_maturity) VALUES 	(seq_product.nextval,1,	'CHUBB LTD'	,null,null)	;
INSERT INTO tbl_product (id, id_type, nazev, dt_issue,dt_maturity) VALUES 	(seq_product.nextval,1,	'COMPAGNIE FINANCIER RICHEMONT SA'	,null,null)	;
INSERT INTO tbl_product (id, id_type, nazev, dt_issue,dt_maturity) VALUES 	(seq_product.nextval,1,	'ZKB GOLD ETF'	,null,null)	;
INSERT INTO tbl_product (id, id_type, nazev, dt_issue,dt_maturity) VALUES 	(seq_product.nextval,1,	'TRANSOCEAN LTD'	,null,null)	;
INSERT INTO tbl_product (id, id_type, nazev, dt_issue,dt_maturity) VALUES 	(seq_product.nextval,1,	'TE Connectivity Ltd'	,null,null)	;
INSERT INTO tbl_product (id, id_type, nazev, dt_issue,dt_maturity) VALUES 	(seq_product.nextval,1,	'GARMIN LTD'	,null,null)	;
INSERT INTO tbl_product (id, id_type, nazev, dt_issue,dt_maturity) VALUES 	(seq_product.nextval,1,	'PENTAIR LTD.'	,null,null)	;
INSERT INTO tbl_product (id, id_type, nazev, dt_issue,dt_maturity) VALUES 	(seq_product.nextval,1,	'COCA-COLA HBC AG-DI'	,null,null)	;
INSERT INTO tbl_product (id, id_type, nazev, dt_issue,dt_maturity) VALUES 	(seq_product.nextval,1,	'CIE FINANCIERE RICHEMONT-REG'	,null,null)	;
INSERT INTO tbl_product (id, id_type, nazev, dt_issue,dt_maturity) VALUES 	(seq_product.nextval,1,	'UBS AG - CHF'	,null,null)	;
INSERT INTO tbl_product (id, id_type, nazev, dt_issue,dt_maturity) VALUES 	(seq_product.nextval,1,	'NESTLE SA-REG CHF'	,null,null)	;
INSERT INTO tbl_product (id, id_type, nazev, dt_issue,dt_maturity) VALUES 	(seq_product.nextval,1,	'ABB LTD. EUR'	,null,null)	;
INSERT INTO tbl_product (id, id_type, nazev, dt_issue,dt_maturity) VALUES 	(seq_product.nextval,1,	'CRH PLC'	,null,null)	;
INSERT INTO tbl_product (id, id_type, nazev, dt_issue,dt_maturity) VALUES 	(seq_product.nextval,1,	'DCC PLC'	,null,null)	;
INSERT INTO tbl_product (id, id_type, nazev, dt_issue,dt_maturity) VALUES 	(seq_product.nextval,1,	'KINGSPAN GROUP PLC'	,null,null)	;
INSERT INTO tbl_product (id, id_type, nazev, dt_issue,dt_maturity) VALUES 	(seq_product.nextval,1,	'ISHARES CORE FTSE 100 UCITS'	,null,null)	;
INSERT INTO tbl_product (id, id_type, nazev, dt_issue,dt_maturity) VALUES 	(seq_product.nextval,1,	'READYMIX PLC'	,null,null)	;
INSERT INTO tbl_product (id, id_type, nazev, dt_issue,dt_maturity) VALUES 	(seq_product.nextval,1,	'ISHARES II PLC'	,null,null)	;
INSERT INTO tbl_product (id, id_type, nazev, dt_issue,dt_maturity) VALUES 	(seq_product.nextval,1,	'iShares EURO STOXX 50'	,null,null)	;
INSERT INTO tbl_product (id, id_type, nazev, dt_issue,dt_maturity) VALUES 	(seq_product.nextval,1,	'BANK OF IRELAND'	,null,null)	;
INSERT INTO tbl_product (id, id_type, nazev, dt_issue,dt_maturity) VALUES 	(seq_product.nextval,1,	'CONSEQ INVEST DLUHOPISOVY OPF'	,null,null)	;
INSERT INTO tbl_product (id, id_type, nazev, dt_issue,dt_maturity) VALUES 	(seq_product.nextval,1,	'CONSEQ INVEST PLC - EQUITY FUND '	,null,null)	;
INSERT INTO tbl_product (id, id_type, nazev, dt_issue,dt_maturity) VALUES 	(seq_product.nextval,1,	'ISHARES SP 500 UCITS ETF DIST'	,null,null)	;
INSERT INTO tbl_product (id, id_type, nazev, dt_issue,dt_maturity) VALUES 	(seq_product.nextval,1,	'INVESCO NASDAQ-100 DIST ETF'	,null,null)	;
INSERT INTO tbl_product (id, id_type, nazev, dt_issue,dt_maturity) VALUES 	(seq_product.nextval,1,	'BAREP Global Credit Class B (EUR)'	,null,null)	;
INSERT INTO tbl_product (id, id_type, nazev, dt_issue,dt_maturity) VALUES 	(seq_product.nextval,1,	'Sirius Emerging Equity Fund EUR'	,null,null)	;
INSERT INTO tbl_product (id, id_type, nazev, dt_issue,dt_maturity) VALUES 	(seq_product.nextval,1,	'CONSEQ INVEST CONSERV. BOND F.'	,null,null)	;
INSERT INTO tbl_product (id, id_type, nazev, dt_issue,dt_maturity) VALUES 	(seq_product.nextval,1,	'Emerging Europe Debt Fund A-shares CZK'	,null,null)	;
INSERT INTO tbl_product (id, id_type, nazev, dt_issue,dt_maturity) VALUES 	(seq_product.nextval,1,	'Thames River High Income Fund'	,null,null)	;
INSERT INTO tbl_product (id, id_type, nazev, dt_issue,dt_maturity) VALUES 	(seq_product.nextval,1,	'ANGLO IRISH BANK CORP PLC  old acquired'	,null,null)	;
INSERT INTO tbl_product (id, id_type, nazev, dt_issue,dt_maturity) VALUES 	(seq_product.nextval,1,	'ISHARES EURSTOXX SELECT DIV30 GBP'	,null,null)	;
INSERT INTO tbl_product (id, id_type, nazev, dt_issue,dt_maturity) VALUES 	(seq_product.nextval,1,	'ISHARES FTSE UK DIVIDEND PLUS'	,null,null)	;
INSERT INTO tbl_product (id, id_type, nazev, dt_issue,dt_maturity) VALUES 	(seq_product.nextval,1,	'ISHARES MSCI EMERG. MKTS'	,null,null)	;
INSERT INTO tbl_product (id, id_type, nazev, dt_issue,dt_maturity) VALUES 	(seq_product.nextval,1,	'iShares European Property Yield UCITS ETF '	,null,null)	;
INSERT INTO tbl_product (id, id_type, nazev, dt_issue,dt_maturity) VALUES 	(seq_product.nextval,1,	'ISHARES MSCI AC FAR EAST EX-JAPAN ETF'	,null,null)	;
INSERT INTO tbl_product (id, id_type, nazev, dt_issue,dt_maturity) VALUES 	(seq_product.nextval,1,	'CONSEQ INVEST NEW EUROPE BOND F.'	,null,null)	;
INSERT INTO tbl_product (id, id_type, nazev, dt_issue,dt_maturity) VALUES 	(seq_product.nextval,1,	'IVY Rosewood Diversified Feeder Fund EUR'	,null,null)	;
INSERT INTO tbl_product (id, id_type, nazev, dt_issue,dt_maturity) VALUES 	(seq_product.nextval,1,	'ISHARES DJ ASIA/PAC SD 30 ETF'	,null,null)	;
INSERT INTO tbl_product (id, id_type, nazev, dt_issue,dt_maturity) VALUES 	(seq_product.nextval,1,	'ISHARES ASIA PROPERTY YIELD UCITS ETF'	,null,null)	;
INSERT INTO tbl_product (id, id_type, nazev, dt_issue,dt_maturity) VALUES 	(seq_product.nextval,1,	'iShares Developed Markets Property Yield UCITS ETF '	,null,null)	;
INSERT INTO tbl_product (id, id_type, nazev, dt_issue,dt_maturity) VALUES 	(seq_product.nextval,1,	'ISHARES MSCI TURKEY FUND'	,null,null)	;
INSERT INTO tbl_product (id, id_type, nazev, dt_issue,dt_maturity) VALUES 	(seq_product.nextval,1,	'SMURFIT KAPPA GROUP PLC'	,null,null)	;
INSERT INTO tbl_product (id, id_type, nazev, dt_issue,dt_maturity) VALUES 	(seq_product.nextval,1,	'ISHARES FTSE MIB UCITS ETF'	,null,null)	;
INSERT INTO tbl_product (id, id_type, nazev, dt_issue,dt_maturity) VALUES 	(seq_product.nextval,1,	'ISHARES SP EMER MRKT INFRAS'	,null,null)	;
INSERT INTO tbl_product (id, id_type, nazev, dt_issue,dt_maturity) VALUES 	(seq_product.nextval,1,	'ISHARES BC GBL INF LNK BD'	,null,null)	;
INSERT INTO tbl_product (id, id_type, nazev, dt_issue,dt_maturity) VALUES 	(seq_product.nextval,1,	'SOURCE MSCI EMERG. MARKETSUCITS ETF-A'	,null,null)	;
INSERT INTO tbl_product (id, id_type, nazev, dt_issue,dt_maturity) VALUES 	(seq_product.nextval,1,	'ISHARES CORE EURO CORP BOND UCITS ETF'	,null,null)	;
INSERT INTO tbl_product (id, id_type, nazev, dt_issue,dt_maturity) VALUES 	(seq_product.nextval,1,	'GENERALI EMERGING EUROPE A CZK'	,null,null)	;
INSERT INTO tbl_product (id, id_type, nazev, dt_issue,dt_maturity) VALUES 	(seq_product.nextval,1,	'GENERALI EMERGING EUROPE A PLN'	,null,null)	;
INSERT INTO tbl_product (id, id_type, nazev, dt_issue,dt_maturity) VALUES 	(seq_product.nextval,1,	'GENERALI OIL AND ENERGY A PLN'	,null,null)	;
INSERT INTO tbl_product (id, id_type, nazev, dt_issue,dt_maturity) VALUES 	(seq_product.nextval,1,	'VANGUARD FTSE EMERGING MARKETS ETF'	,null,null)	;
INSERT INTO tbl_product (id, id_type, nazev, dt_issue,dt_maturity) VALUES 	(seq_product.nextval,1,	'VANGUARD SP 500 ETF / IE'	,null,null)	;
INSERT INTO tbl_product (id, id_type, nazev, dt_issue,dt_maturity) VALUES 	(seq_product.nextval,1,	'SOURCE SP 500 ETF'	,null,null)	;
INSERT INTO tbl_product (id, id_type, nazev, dt_issue,dt_maturity) VALUES 	(seq_product.nextval,1,	'GENERALI GLOBAL EQUITY A PLN'	,null,null)	;
INSERT INTO tbl_product (id, id_type, nazev, dt_issue,dt_maturity) VALUES 	(seq_product.nextval,1,	'INVESCO PHYSICAL PLATINUM'	,null,null)	;
INSERT INTO tbl_product (id, id_type, nazev, dt_issue,dt_maturity) VALUES 	(seq_product.nextval,1,	'GENERALI PREMIUM CONSERVATIVE A EUR'	,null,null)	;
INSERT INTO tbl_product (id, id_type, nazev, dt_issue,dt_maturity) VALUES 	(seq_product.nextval,1,	'GENERALI CORPORATE BONDS A EUR'	,null,null)	;
INSERT INTO tbl_product (id, id_type, nazev, dt_issue,dt_maturity) VALUES 	(seq_product.nextval,1,	'GENERALI OIL AND ENERGY A EUR'	,null,null)	;
INSERT INTO tbl_product (id, id_type, nazev, dt_issue,dt_maturity) VALUES 	(seq_product.nextval,1,	'INVESCO PHYSICAL SILVER ETC'	,null,null)	;
INSERT INTO tbl_product (id, id_type, nazev, dt_issue,dt_maturity) VALUES 	(seq_product.nextval,1,	'WARNER CHILCOTT PLC-CLASS A'	,null,null)	;
INSERT INTO tbl_product (id, id_type, nazev, dt_issue,dt_maturity) VALUES 	(seq_product.nextval,1,	'GENERALI GLOBAL EQUITY A EUR'	,null,null)	;
INSERT INTO tbl_product (id, id_type, nazev, dt_issue,dt_maturity) VALUES 	(seq_product.nextval,1,	'GENERALI NEW ECONOMIES A EUR'	,null,null)	;
INSERT INTO tbl_product (id, id_type, nazev, dt_issue,dt_maturity) VALUES 	(seq_product.nextval,1,	'ISHARES PHYSICAL PALLADIUM ETC'	,null,null)	;
INSERT INTO tbl_product (id, id_type, nazev, dt_issue,dt_maturity) VALUES 	(seq_product.nextval,1,	'GENERALI COMMODITY A EUR'	,null,null)	;
INSERT INTO tbl_product (id, id_type, nazev, dt_issue,dt_maturity) VALUES 	(seq_product.nextval,1,	'ACCENTURE LTD'	,null,null)	;
INSERT INTO tbl_product (id, id_type, nazev, dt_issue,dt_maturity) VALUES 	(seq_product.nextval,1,	'ISHARES CORE MSCI WORLD UCITS ETF'	,null,null)	;
INSERT INTO tbl_product (id, id_type, nazev, dt_issue,dt_maturity) VALUES 	(seq_product.nextval,1,	'ISHARES PHYSICAL PLATINUM ETC'	,null,null)	;
INSERT INTO tbl_product (id, id_type, nazev, dt_issue,dt_maturity) VALUES 	(seq_product.nextval,1,	'INVESCO PHYSICAL PALLADIUM'	,null,null)	;
INSERT INTO tbl_product (id, id_type, nazev, dt_issue,dt_maturity) VALUES 	(seq_product.nextval,1,	'ISHARES MSCI POLAND ETF'	,null,null)	;
INSERT INTO tbl_product (id, id_type, nazev, dt_issue,dt_maturity) VALUES 	(seq_product.nextval,1,	'ISHARES PHYSICAL SILVER ETC'	,null,null)	;
INSERT INTO tbl_product (id, id_type, nazev, dt_issue,dt_maturity) VALUES 	(seq_product.nextval,1,	'ISHARES PHYSICAL GOLD ETC'	,null,null)	;
INSERT INTO tbl_product (id, id_type, nazev, dt_issue,dt_maturity) VALUES 	(seq_product.nextval,1,	'JAZZ PHARMACEUTICALS PLC'	,null,null)	;
INSERT INTO tbl_product (id, id_type, nazev, dt_issue,dt_maturity) VALUES 	(seq_product.nextval,1,	'GENERALI NEW ECONOMIES A PLN'	,null,null)	;
INSERT INTO tbl_product (id, id_type, nazev, dt_issue,dt_maturity) VALUES 	(seq_product.nextval,1,	'ISHARES FTSE 100 UCITS ACC'	,null,null)	;
INSERT INTO tbl_product (id, id_type, nazev, dt_issue,dt_maturity) VALUES 	(seq_product.nextval,1,	'ISHARES DJ INDUSTRIAL AVERAGE UCITS ETF'	,null,null)	;
INSERT INTO tbl_product (id, id_type, nazev, dt_issue,dt_maturity) VALUES 	(seq_product.nextval,1,	'ISHARES NASDAQ 100 USD ACC ETF'	,null,null)	;
INSERT INTO tbl_product (id, id_type, nazev, dt_issue,dt_maturity) VALUES 	(seq_product.nextval,1,	'INVESCO PHYSICAL GOLD ETC'	,null,null)	;
INSERT INTO tbl_product (id, id_type, nazev, dt_issue,dt_maturity) VALUES 	(seq_product.nextval,1,	'SEAGATE TECHNOLOGY'	,null,null)	;
INSERT INTO tbl_product (id, id_type, nazev, dt_issue,dt_maturity) VALUES 	(seq_product.nextval,1,	'GENERALI EMERGING EUROPE I EUR'	,null,null)	;
INSERT INTO tbl_product (id, id_type, nazev, dt_issue,dt_maturity) VALUES 	(seq_product.nextval,1,	'SOURCE EUROPE PLUS'	,null,null)	;
INSERT INTO tbl_product (id, id_type, nazev, dt_issue,dt_maturity) VALUES 	(seq_product.nextval,1,	'ISHARES CORE SP 500 UCITS ETF'	,null,null)	;
INSERT INTO tbl_product (id, id_type, nazev, dt_issue,dt_maturity) VALUES 	(seq_product.nextval,1,	'HSBC MSCI TURKEY UCITS ETF'	,null,null)	;
INSERT INTO tbl_product (id, id_type, nazev, dt_issue,dt_maturity) VALUES 	(seq_product.nextval,1,	'INVESCO STX 600 OPT BANKS UCITS ETF'	,null,null)	;
INSERT INTO tbl_product (id, id_type, nazev, dt_issue,dt_maturity) VALUES 	(seq_product.nextval,1,	'ISHARES MSCI RUSSIA ADR/GDR ETF'	,null,null)	;
INSERT INTO tbl_product (id, id_type, nazev, dt_issue,dt_maturity) VALUES 	(seq_product.nextval,1,	'GENERALI COMMODITY A CZK'	,null,null)	;
INSERT INTO tbl_product (id, id_type, nazev, dt_issue,dt_maturity) VALUES 	(seq_product.nextval,1,	'SOURCE EURO STOXX 50 ETF - A'	,null,null)	;
INSERT INTO tbl_product (id, id_type, nazev, dt_issue,dt_maturity) VALUES 	(seq_product.nextval,1,	'INVESCO MSCI WORLD ETF'	,null,null)	;
INSERT INTO tbl_product (id, id_type, nazev, dt_issue,dt_maturity) VALUES 	(seq_product.nextval,1,	'INGERSOLL-RAND PLC.'	,null,null)	;
INSERT INTO tbl_product (id, id_type, nazev, dt_issue,dt_maturity) VALUES 	(seq_product.nextval,1,	'GENERALI EMERGING EUROPE A EUR'	,null,null)	;
INSERT INTO tbl_product (id, id_type, nazev, dt_issue,dt_maturity) VALUES 	(seq_product.nextval,1,	'ISHARES EMERGING MKT DIV UCITS'	,null,null)	;
INSERT INTO tbl_product (id, id_type, nazev, dt_issue,dt_maturity) VALUES 	(seq_product.nextval,1,	'ISHARES MARKIT IBOXX EUR H/Y'	,null,null)	;
INSERT INTO tbl_product (id, id_type, nazev, dt_issue,dt_maturity) VALUES 	(seq_product.nextval,1,	'GENERALI COMMODITY A PLN'	,null,null)	;
INSERT INTO tbl_product (id, id_type, nazev, dt_issue,dt_maturity) VALUES 	(seq_product.nextval,1,	'ISHARES SP 500 MINIMUM VOLATILITY UCITS ETF'	,null,null)	;
INSERT INTO tbl_product (id, id_type, nazev, dt_issue,dt_maturity) VALUES 	(seq_product.nextval,1,	'GENERALI CORPORATE BONDS B EUR'	,null,null)	;
INSERT INTO tbl_product (id, id_type, nazev, dt_issue,dt_maturity) VALUES 	(seq_product.nextval,1,	'GENERALI PREMIUM CONSERVATIVE A PLN'	,null,null)	;
INSERT INTO tbl_product (id, id_type, nazev, dt_issue,dt_maturity) VALUES 	(seq_product.nextval,1,	'GENERALI CORPORATE BONDS A PLN'	,null,null)	;
INSERT INTO tbl_product (id, id_type, nazev, dt_issue,dt_maturity) VALUES 	(seq_product.nextval,1,	'SSGA SPDR ETFS EUR SP 500'	,null,null)	;
INSERT INTO tbl_product (id, id_type, nazev, dt_issue,dt_maturity) VALUES 	(seq_product.nextval,1,	'GENERALI CORPORATE BONDS B CZK'	,null,null)	;
INSERT INTO tbl_product (id, id_type, nazev, dt_issue,dt_maturity) VALUES 	(seq_product.nextval,1,	'GENERALI CORPORATE BONDS B RON'	,null,null)	;
INSERT INTO tbl_product (id, id_type, nazev, dt_issue,dt_maturity) VALUES 	(seq_product.nextval,1,	'GENERALI CORPORATE BONDS B PLN'	,null,null)	;
INSERT INTO tbl_product (id, id_type, nazev, dt_issue,dt_maturity) VALUES 	(seq_product.nextval,1,	'GENERALI CORPORATE BONDS B HUF'	,null,null)	;
INSERT INTO tbl_product (id, id_type, nazev, dt_issue,dt_maturity) VALUES 	(seq_product.nextval,1,	'GENERALI EMER. EUROPE BOND Y EUR'	,null,null)	;
INSERT INTO tbl_product (id, id_type, nazev, dt_issue,dt_maturity) VALUES 	(seq_product.nextval,1,	'GENERALI EMER. EUROPE BOND A PLN'	,null,null)	;
INSERT INTO tbl_product (id, id_type, nazev, dt_issue,dt_maturity) VALUES 	(seq_product.nextval,1,	'GENERALI EMER. EUROPE BOND A RON'	,null,null)	;
INSERT INTO tbl_product (id, id_type, nazev, dt_issue,dt_maturity) VALUES 	(seq_product.nextval,1,	'ISHARES MSCI EUROPE MINIMUM VOLATILITY UCITS ETF'	,null,null)	;
INSERT INTO tbl_product (id, id_type, nazev, dt_issue,dt_maturity) VALUES 	(seq_product.nextval,1,	'iShares MSCI World Minimum Volatility UCITS ETF '	,null,null)	;
INSERT INTO tbl_product (id, id_type, nazev, dt_issue,dt_maturity) VALUES 	(seq_product.nextval,1,	'iShares MSCI Emerging Market Minimum Volatility UCITS ETF '	,null,null)	;
INSERT INTO tbl_product (id, id_type, nazev, dt_issue,dt_maturity) VALUES 	(seq_product.nextval,1,	'EATON CORP PLC'	,null,null)	;
INSERT INTO tbl_product (id, id_type, nazev, dt_issue,dt_maturity) VALUES 	(seq_product.nextval,1,	'GENERALI EMER. EUROPE BOND A EUR'	,null,null)	;
INSERT INTO tbl_product (id, id_type, nazev, dt_issue,dt_maturity) VALUES 	(seq_product.nextval,1,	'GENERALI EMER. EUROPE BOND A HUF'	,null,null)	;
INSERT INTO tbl_product (id, id_type, nazev, dt_issue,dt_maturity) VALUES 	(seq_product.nextval,1,	'VANGUARD FTSE JAPAN UCITS'	,null,null)	;
INSERT INTO tbl_product (id, id_type, nazev, dt_issue,dt_maturity) VALUES 	(seq_product.nextval,1,	'GENERALI EMER. EUROPE BOND A CZK'	,null,null)	;
INSERT INTO tbl_product (id, id_type, nazev, dt_issue,dt_maturity) VALUES 	(seq_product.nextval,1,	'GENERALI EMERGING EUROPE Y EUR DIV'	,null,null)	;
INSERT INTO tbl_product (id, id_type, nazev, dt_issue,dt_maturity) VALUES 	(seq_product.nextval,1,	'FINISTERRE DM DEBT FUND EURO I CLASS'	,null,null)	;
INSERT INTO tbl_product (id, id_type, nazev, dt_issue,dt_maturity) VALUES 	(seq_product.nextval,1,	'HSBC MSCI AC FAR EAST EX JAPAN'	,null,null)	;
INSERT INTO tbl_product (id, id_type, nazev, dt_issue,dt_maturity) VALUES 	(seq_product.nextval,1,	'GENERALI PREMIUM CONSERVATIVE A CZK'	,null,null)	;
INSERT INTO tbl_product (id, id_type, nazev, dt_issue,dt_maturity) VALUES 	(seq_product.nextval,1,	'GENERALI CORPORATE BONDS A CZK'	,null,null)	;
INSERT INTO tbl_product (id, id_type, nazev, dt_issue,dt_maturity) VALUES 	(seq_product.nextval,1,	'ALLERGAN PLC old'	,null,null)	;
INSERT INTO tbl_product (id, id_type, nazev, dt_issue,dt_maturity) VALUES 	(seq_product.nextval,1,	'INVESCO BLOOMBERG COMMODITY ETF'	,null,null)	;
INSERT INTO tbl_product (id, id_type, nazev, dt_issue,dt_maturity) VALUES 	(seq_product.nextval,1,	'ADIENT PLC'	,null,null)	;
INSERT INTO tbl_product (id, id_type, nazev, dt_issue,dt_maturity) VALUES 	(seq_product.nextval,1,	'WILLIS TOWERS WATSON PLC'	,null,null)	;
INSERT INTO tbl_product (id, id_type, nazev, dt_issue,dt_maturity) VALUES 	(seq_product.nextval,1,	'nVent Electric PLC'	,null,null)	;
INSERT INTO tbl_product (id, id_type, nazev, dt_issue,dt_maturity) VALUES 	(seq_product.nextval,1,	'ALLEGION PLC'	,null,null)	;
INSERT INTO tbl_product (id, id_type, nazev, dt_issue,dt_maturity) VALUES 	(seq_product.nextval,1,	'SPDR EURO STOXX LOW Volatility UCITS ETF'	,null,null)	;
INSERT INTO tbl_product (id, id_type, nazev, dt_issue,dt_maturity) VALUES 	(seq_product.nextval,1,	'PERRIGO CO PLC'	,null,null)	;
INSERT INTO tbl_product (id, id_type, nazev, dt_issue,dt_maturity) VALUES 	(seq_product.nextval,1,	'GENERALI PREMIUM BALANCED A EUR'	,null,null)	;
INSERT INTO tbl_product (id, id_type, nazev, dt_issue,dt_maturity) VALUES 	(seq_product.nextval,1,	'GENERALI PREMIUM BALANCED A CZK'	,null,null)	;
INSERT INTO tbl_product (id, id_type, nazev, dt_issue,dt_maturity) VALUES 	(seq_product.nextval,1,	'GENERALI PREMIUM BALANCED A PLN'	,null,null)	;
INSERT INTO tbl_product (id, id_type, nazev, dt_issue,dt_maturity) VALUES 	(seq_product.nextval,1,	'GENERALI PREMIUM BALANCED A HUF'	,null,null)	;
INSERT INTO tbl_product (id, id_type, nazev, dt_issue,dt_maturity) VALUES 	(seq_product.nextval,1,	'GENERALI PREMIUM BALANCED A RON'	,null,null)	;
INSERT INTO tbl_product (id, id_type, nazev, dt_issue,dt_maturity) VALUES 	(seq_product.nextval,1,	'GENERALI PREMIUM BALANCED B EUR'	,null,null)	;
INSERT INTO tbl_product (id, id_type, nazev, dt_issue,dt_maturity) VALUES 	(seq_product.nextval,1,	'GENERALI PREMIUM BALANCED B CZK'	,null,null)	;
INSERT INTO tbl_product (id, id_type, nazev, dt_issue,dt_maturity) VALUES 	(seq_product.nextval,1,	'GENERALI PREMIUM BALANCED B PLN'	,null,null)	;
INSERT INTO tbl_product (id, id_type, nazev, dt_issue,dt_maturity) VALUES 	(seq_product.nextval,1,	'GENERALI PREMIUM BALANCED B HUF'	,null,null)	;
INSERT INTO tbl_product (id, id_type, nazev, dt_issue,dt_maturity) VALUES 	(seq_product.nextval,1,	'GENERALI PREMIUM BALANCED B RON'	,null,null)	;
INSERT INTO tbl_product (id, id_type, nazev, dt_issue,dt_maturity) VALUES 	(seq_product.nextval,1,	'GENERALI DYNAMIC BALANCED A EUR'	,null,null)	;
INSERT INTO tbl_product (id, id_type, nazev, dt_issue,dt_maturity) VALUES 	(seq_product.nextval,1,	'GENERALI DYNAMIC BALANCED A CZK'	,null,null)	;
INSERT INTO tbl_product (id, id_type, nazev, dt_issue,dt_maturity) VALUES 	(seq_product.nextval,1,	'GENERALI DYNAMIC BALANCED A PLN'	,null,null)	;
INSERT INTO tbl_product (id, id_type, nazev, dt_issue,dt_maturity) VALUES 	(seq_product.nextval,1,	'GENERALI DYNAMIC BALANCED A HUF'	,null,null)	;
INSERT INTO tbl_product (id, id_type, nazev, dt_issue,dt_maturity) VALUES 	(seq_product.nextval,1,	'GENERALI DYNAMIC BALANCED A RON'	,null,null)	;
INSERT INTO tbl_product (id, id_type, nazev, dt_issue,dt_maturity) VALUES 	(seq_product.nextval,1,	'GENERALI DYNAMIC BALANCED B EUR'	,null,null)	;
INSERT INTO tbl_product (id, id_type, nazev, dt_issue,dt_maturity) VALUES 	(seq_product.nextval,1,	'GENERALI DYNAMIC BALANCED B CZK'	,null,null)	;
INSERT INTO tbl_product (id, id_type, nazev, dt_issue,dt_maturity) VALUES 	(seq_product.nextval,1,	'GENERALI DYNAMIC BALANCED B PLN'	,null,null)	;
INSERT INTO tbl_product (id, id_type, nazev, dt_issue,dt_maturity) VALUES 	(seq_product.nextval,1,	'GENERALI DYNAMIC BALANCED B HUF'	,null,null)	;
INSERT INTO tbl_product (id, id_type, nazev, dt_issue,dt_maturity) VALUES 	(seq_product.nextval,1,	'GENERALI DYNAMIC BALANCED B RON'	,null,null)	;
INSERT INTO tbl_product (id, id_type, nazev, dt_issue,dt_maturity) VALUES 	(seq_product.nextval,1,	'SPDR Russell 2000 US Small Cap UCIS ETF'	,null,null)	;
INSERT INTO tbl_product (id, id_type, nazev, dt_issue,dt_maturity) VALUES 	(seq_product.nextval,1,	'ENDO INTERNATIONAL PLC'	,null,null)	;
INSERT INTO tbl_product (id, id_type, nazev, dt_issue,dt_maturity) VALUES 	(seq_product.nextval,1,	'KING DIGITAL ENTERTAINMENT PLC'	,null,null)	;
INSERT INTO tbl_product (id, id_type, nazev, dt_issue,dt_maturity) VALUES 	(seq_product.nextval,1,	'ISHARES CORE MSCI EM IMI UCITS - USD'	,null,null)	;
INSERT INTO tbl_product (id, id_type, nazev, dt_issue,dt_maturity) VALUES 	(seq_product.nextval,1,	'GENERALI GLOBAL EQUITY A CZK'	,null,null)	;
INSERT INTO tbl_product (id, id_type, nazev, dt_issue,dt_maturity) VALUES 	(seq_product.nextval,1,	'DB X-TRACKERS EQUITY LOW BETA FACTOR UCITS ETF'	,null,null)	;
INSERT INTO tbl_product (id, id_type, nazev, dt_issue,dt_maturity) VALUES 	(seq_product.nextval,1,	'PENTAIR PLC'	,null,null)	;
INSERT INTO tbl_product (id, id_type, nazev, dt_issue,dt_maturity) VALUES 	(seq_product.nextval,1,	'DB X-TRACKERS MSCI WORLD INDUSTRIALS TRN INDEX UCITS ETF'	,null,null)	;
INSERT INTO tbl_product (id, id_type, nazev, dt_issue,dt_maturity) VALUES 	(seq_product.nextval,1,	'SOURCE NASDAQ BIOTECH UCITS ETF'	,null,null)	;
INSERT INTO tbl_product (id, id_type, nazev, dt_issue,dt_maturity) VALUES 	(seq_product.nextval,1,	'MV GOLD MINERS UCITS ETF'	,null,null)	;
INSERT INTO tbl_product (id, id_type, nazev, dt_issue,dt_maturity) VALUES 	(seq_product.nextval,1,	'VANECK VECTORS JUNIOR GOLD MINERS UCITS ETF'	,null,null)	;
INSERT INTO tbl_product (id, id_type, nazev, dt_issue,dt_maturity) VALUES 	(seq_product.nextval,1,	'ISHARES EUR CORP BBB-BB'	,null,null)	;
INSERT INTO tbl_product (id, id_type, nazev, dt_issue,dt_maturity) VALUES 	(seq_product.nextval,1,	'MEDTRONIC PLC.'	,null,null)	;
INSERT INTO tbl_product (id, id_type, nazev, dt_issue,dt_maturity) VALUES 	(seq_product.nextval,1,	'PADDY POWER BETFAIR PLC'	,null,null)	;
INSERT INTO tbl_product (id, id_type, nazev, dt_issue,dt_maturity) VALUES 	(seq_product.nextval,1,	'UBS ETF FACTOR LOW VOLATLY'	,null,null)	;
INSERT INTO tbl_product (id, id_type, nazev, dt_issue,dt_maturity) VALUES 	(seq_product.nextval,1,	'JOHNSON CONTROLS INTL PLC'	,null,null)	;
INSERT INTO tbl_product (id, id_type, nazev, dt_issue,dt_maturity) VALUES 	(seq_product.nextval,1,	'ALLERGAN PLC'	,null,null)	;
INSERT INTO tbl_product (id, id_type, nazev, dt_issue,dt_maturity) VALUES 	(seq_product.nextval,1,	'BOOST BTP 10Y 5X SHORT DAILY'	,null,null)	;
INSERT INTO tbl_product (id, id_type, nazev, dt_issue,dt_maturity) VALUES 	(seq_product.nextval,1,	'RYANAIR HOLDINGS PLC'	,null,null)	;
INSERT INTO tbl_product (id, id_type, nazev, dt_issue,dt_maturity) VALUES 	(seq_product.nextval,1,	'GENERALI Premium Dynamic A EUR'	,null,null)	;
INSERT INTO tbl_product (id, id_type, nazev, dt_issue,dt_maturity) VALUES 	(seq_product.nextval,1,	'GENERALI Premium Dynamic A CZK'	,null,null)	;
INSERT INTO tbl_product (id, id_type, nazev, dt_issue,dt_maturity) VALUES 	(seq_product.nextval,1,	'GENERALI Premium Dynamic A PLN'	,null,null)	;
INSERT INTO tbl_product (id, id_type, nazev, dt_issue,dt_maturity) VALUES 	(seq_product.nextval,1,	'LINDE PLC'	,null,null)	;
INSERT INTO tbl_product (id, id_type, nazev, dt_issue,dt_maturity) VALUES 	(seq_product.nextval,1,	'ISHARES EURO STOXX 50 EUE_IM'	,null,null)	;
INSERT INTO tbl_product (id, id_type, nazev, dt_issue,dt_maturity) VALUES 	(seq_product.nextval,1,	'ISHARES DJ ASIA/PAC SD 30 ETF GBP'	,null,null)	;
INSERT INTO tbl_product (id, id_type, nazev, dt_issue,dt_maturity) VALUES 	(seq_product.nextval,1,	'ISHARES EMERGING MKT DIV UCITS USD'	,null,null)	;
INSERT INTO tbl_product (id, id_type, nazev, dt_issue,dt_maturity) VALUES 	(seq_product.nextval,1,	'ISHARES CORE MSCI EM IMI UCITS - EUR'	,null,null)	;
INSERT INTO tbl_product (id, id_type, nazev, dt_issue,dt_maturity) VALUES 	(seq_product.nextval,1,	'ISHARES ASIA/PAC Dividend UCITS ETF USD'	,null,null)	;
INSERT INTO tbl_product (id, id_type, nazev, dt_issue,dt_maturity) VALUES 	(seq_product.nextval,1,	'ELBIT SYSTEMS LTD'	,null,null)	;
INSERT INTO tbl_product (id, id_type, nazev, dt_issue,dt_maturity) VALUES 	(seq_product.nextval,1,	'CHECK POINT SW TECH'	,null,null)	;
INSERT INTO tbl_product (id, id_type, nazev, dt_issue,dt_maturity) VALUES 	(seq_product.nextval,1,	'VIZRT LTD.'	,null,null)	;
INSERT INTO tbl_product (id, id_type, nazev, dt_issue,dt_maturity) VALUES 	(seq_product.nextval,1,	'COMPUGEN LTD.'	,null,null)	;
INSERT INTO tbl_product (id, id_type, nazev, dt_issue,dt_maturity) VALUES 	(seq_product.nextval,1,	'SODASTREAM INTERNATIONAL LTD'	,null,null)	;
INSERT INTO tbl_product (id, id_type, nazev, dt_issue,dt_maturity) VALUES 	(seq_product.nextval,1,	'GENERALI ASSICURAZIONI SPA'	,null,null)	;
INSERT INTO tbl_product (id, id_type, nazev, dt_issue,dt_maturity) VALUES 	(seq_product.nextval,1,	'VITTORIA ASSICURAZIONI SPA'	,null,null)	;
INSERT INTO tbl_product (id, id_type, nazev, dt_issue,dt_maturity) VALUES 	(seq_product.nextval,1,	'UNICREDIT SPA - OLD'	,null,null)	;
INSERT INTO tbl_product (id, id_type, nazev, dt_issue,dt_maturity) VALUES 	(seq_product.nextval,1,	'BPER BANCA'	,null,null)	;
INSERT INTO tbl_product (id, id_type, nazev, dt_issue,dt_maturity) VALUES 	(seq_product.nextval,1,	'SAIPEM SPA'	,null,null)	;
INSERT INTO tbl_product (id, id_type, nazev, dt_issue,dt_maturity) VALUES 	(seq_product.nextval,1,	'FINECOBANK SPA'	,null,null)	;
INSERT INTO tbl_product (id, id_type, nazev, dt_issue,dt_maturity) VALUES 	(seq_product.nextval,1,	'INTESA SANPAOLO'	,null,null)	;
INSERT INTO tbl_product (id, id_type, nazev, dt_issue,dt_maturity) VALUES 	(seq_product.nextval,1,	'INTESA SANPAOLO-RSP'	,null,null)	;
INSERT INTO tbl_product (id, id_type, nazev, dt_issue,dt_maturity) VALUES 	(seq_product.nextval,1,	'DANIELI  CO-RSP'	,null,null)	;
INSERT INTO tbl_product (id, id_type, nazev, dt_issue,dt_maturity) VALUES 	(seq_product.nextval,1,	'DANIELI  CO'	,null,null)	;
INSERT INTO tbl_product (id, id_type, nazev, dt_issue,dt_maturity) VALUES 	(seq_product.nextval,1,	'CATTOLICA ASSICURAZIONI SC'	,null,null)	;
INSERT INTO tbl_product (id, id_type, nazev, dt_issue,dt_maturity) VALUES 	(seq_product.nextval,1,	'MEDIASET SPA'	,null,null)	;
INSERT INTO tbl_product (id, id_type, nazev, dt_issue,dt_maturity) VALUES 	(seq_product.nextval,1,	'BULGARI SPA'	,null,null)	;
INSERT INTO tbl_product (id, id_type, nazev, dt_issue,dt_maturity) VALUES 	(seq_product.nextval,1,	'HERA SPA'	,null,null)	;
INSERT INTO tbl_product (id, id_type, nazev, dt_issue,dt_maturity) VALUES 	(seq_product.nextval,1,	'BUZZI UNICEM SPA'	,null,null)	;
INSERT INTO tbl_product (id, id_type, nazev, dt_issue,dt_maturity) VALUES 	(seq_product.nextval,1,	'BENI STABILI SPA'	,null,null)	;
INSERT INTO tbl_product (id, id_type, nazev, dt_issue,dt_maturity) VALUES 	(seq_product.nextval,1,	'RISANAMENTO SPA'	,null,null)	;
INSERT INTO tbl_product (id, id_type, nazev, dt_issue,dt_maturity) VALUES 	(seq_product.nextval,1,	'GEMINA SPA'	,null,null)	;
INSERT INTO tbl_product (id, id_type, nazev, dt_issue,dt_maturity) VALUES 	(seq_product.nextval,1,	'FIAT SPA'	,null,null)	;
INSERT INTO tbl_product (id, id_type, nazev, dt_issue,dt_maturity) VALUES 	(seq_product.nextval,1,	'FIAT SPA - PFD'	,null,null)	;
INSERT INTO tbl_product (id, id_type, nazev, dt_issue,dt_maturity) VALUES 	(seq_product.nextval,1,	'IREN SPA'	,null,null)	;
INSERT INTO tbl_product (id, id_type, nazev, dt_issue,dt_maturity) VALUES 	(seq_product.nextval,1,	'PIAGGIO  C. S.P.A.'	,null,null)	;
INSERT INTO tbl_product (id, id_type, nazev, dt_issue,dt_maturity) VALUES 	(seq_product.nextval,1,	'ENEL IM'	,null,null)	;
INSERT INTO tbl_product (id, id_type, nazev, dt_issue,dt_maturity) VALUES 	(seq_product.nextval,1,	'ENI SPA'	,null,null)	;
INSERT INTO tbl_product (id, id_type, nazev, dt_issue,dt_maturity) VALUES 	(seq_product.nextval,1,	'SNAM SPA'	,null,null)	;
INSERT INTO tbl_product (id, id_type, nazev, dt_issue,dt_maturity) VALUES 	(seq_product.nextval,1,	'TERNA SPA'	,null,null)	;
INSERT INTO tbl_product (id, id_type, nazev, dt_issue,dt_maturity) VALUES 	(seq_product.nextval,1,	'ASTALDI S.P.A'	,null,null)	;
INSERT INTO tbl_product (id, id_type, nazev, dt_issue,dt_maturity) VALUES 	(seq_product.nextval,1,	'AZIMUT HOLDING'	,null,null)	;
INSERT INTO tbl_product (id, id_type, nazev, dt_issue,dt_maturity) VALUES 	(seq_product.nextval,1,	'PIRELLI  C REAL ESTATE SPA'	,null,null)	;
INSERT INTO tbl_product (id, id_type, nazev, dt_issue,dt_maturity) VALUES 	(seq_product.nextval,1,	'TELECOM ITALIA'	,null,null)	;
INSERT INTO tbl_product (id, id_type, nazev, dt_issue,dt_maturity) VALUES 	(seq_product.nextval,1,	'TELECOM ITALIA-RSP'	,null,null)	;
INSERT INTO tbl_product (id, id_type, nazev, dt_issue,dt_maturity) VALUES 	(seq_product.nextval,1,	'ATLANTIA SPA'	,null,null)	;
INSERT INTO tbl_product (id, id_type, nazev, dt_issue,dt_maturity) VALUES 	(seq_product.nextval,1,	'YOOX NET-A-PORTER Group SPA'	,null,null)	;
INSERT INTO tbl_product (id, id_type, nazev, dt_issue,dt_maturity) VALUES 	(seq_product.nextval,1,	'POSTE ITALIANE SPA'	,null,null)	;
INSERT INTO tbl_product (id, id_type, nazev, dt_issue,dt_maturity) VALUES 	(seq_product.nextval,1,	'RECORDATI SPA'	,null,null)	;
INSERT INTO tbl_product (id, id_type, nazev, dt_issue,dt_maturity) VALUES 	(seq_product.nextval,1,	'LEONARDO SPA'	,null,null)	;
INSERT INTO tbl_product (id, id_type, nazev, dt_issue,dt_maturity) VALUES 	(seq_product.nextval,1,	'SALINI IMPREGILO SPA'	,null,null)	;
INSERT INTO tbl_product (id, id_type, nazev, dt_issue,dt_maturity) VALUES 	(seq_product.nextval,1,	'PRYSMIAN SPA'	,null,null)	;
INSERT INTO tbl_product (id, id_type, nazev, dt_issue,dt_maturity) VALUES 	(seq_product.nextval,1,	'PIRELLI  C REAL ESTATE SPA RTS'	,null,null)	;
INSERT INTO tbl_product (id, id_type, nazev, dt_issue,dt_maturity) VALUES 	(seq_product.nextval,1,	'ENEL SPA AZIONI 06/09'	,null,null)	;
INSERT INTO tbl_product (id, id_type, nazev, dt_issue,dt_maturity) VALUES 	(seq_product.nextval,1,	'ENEL SPA - RTS'	,null,null)	;
INSERT INTO tbl_product (id, id_type, nazev, dt_issue,dt_maturity) VALUES 	(seq_product.nextval,1,	'ENEL GREEN POWER SPA'	,null,null)	;
INSERT INTO tbl_product (id, id_type, nazev, dt_issue,dt_maturity) VALUES 	(seq_product.nextval,1,	'PIRELLI  C SPA'	,null,null)	;
INSERT INTO tbl_product (id, id_type, nazev, dt_issue,dt_maturity) VALUES 	(seq_product.nextval,1,	'FIAT INDUSTRIAL SPA - PFD'	,null,null)	;
INSERT INTO tbl_product (id, id_type, nazev, dt_issue,dt_maturity) VALUES 	(seq_product.nextval,1,	'SALVATORE FERRAGAMO SPA'	,null,null)	;
INSERT INTO tbl_product (id, id_type, nazev, dt_issue,dt_maturity) VALUES 	(seq_product.nextval,1,	'INTESA SANPAOLO - RTS11'	,null,null)	;
INSERT INTO tbl_product (id, id_type, nazev, dt_issue,dt_maturity) VALUES 	(seq_product.nextval,1,	'UNICREDIT SPA'	,null,null)	;
INSERT INTO tbl_product (id, id_type, nazev, dt_issue,dt_maturity) VALUES 	(seq_product.nextval,1,	'UNICREDIT SPA RIGHTS'	,null,null)	;
INSERT INTO tbl_product (id, id_type, nazev, dt_issue,dt_maturity) VALUES 	(seq_product.nextval,1,	'UNIPOL GRUPPO FINANZIARIO SP'	,null,null)	;
INSERT INTO tbl_product (id, id_type, nazev, dt_issue,dt_maturity) VALUES 	(seq_product.nextval,1,	'FIAT SPA RIGHTS 2012'	,null,null)	;
INSERT INTO tbl_product (id, id_type, nazev, dt_issue,dt_maturity) VALUES 	(seq_product.nextval,1,	'FIAT INDUSTRIAL SPA RIGHTS 2012'	,null,null)	;
INSERT INTO tbl_product (id, id_type, nazev, dt_issue,dt_maturity) VALUES 	(seq_product.nextval,1,	'MAIRE TECNIMONT SPA'	,null,null)	;
INSERT INTO tbl_product (id, id_type, nazev, dt_issue,dt_maturity) VALUES 	(seq_product.nextval,1,	'MONCLER SPA'	,null,null)	;
INSERT INTO tbl_product (id, id_type, nazev, dt_issue,dt_maturity) VALUES 	(seq_product.nextval,1,	'BANCA MONTE DEI PASCHI SIENA'	,null,null)	;
INSERT INTO tbl_product (id, id_type, nazev, dt_issue,dt_maturity) VALUES 	(seq_product.nextval,1,	'UNICREDIT SPA RIGHTS 5/2014'	,null,null)	;
INSERT INTO tbl_product (id, id_type, nazev, dt_issue,dt_maturity) VALUES 	(seq_product.nextval,1,	'OVS SPA'	,null,null)	;
INSERT INTO tbl_product (id, id_type, nazev, dt_issue,dt_maturity) VALUES 	(seq_product.nextval,1,	'UNICREDIT SPA RIGHTS 05/2015'	,null,null)	;
INSERT INTO tbl_product (id, id_type, nazev, dt_issue,dt_maturity) VALUES 	(seq_product.nextval,1,	'SAIPEM SPA rights 01/2016'	,null,null)	;
INSERT INTO tbl_product (id, id_type, nazev, dt_issue,dt_maturity) VALUES 	(seq_product.nextval,1,	'ENEL GREEN POWER SPA rights 02/2016'	,null,null)	;
INSERT INTO tbl_product (id, id_type, nazev, dt_issue,dt_maturity) VALUES 	(seq_product.nextval,1,	'UNICREDIT SPA RIGHTS 04/2016'	,null,null)	;
INSERT INTO tbl_product (id, id_type, nazev, dt_issue,dt_maturity) VALUES 	(seq_product.nextval,1,	'BANCO BPM SPA'	,null,null)	;
INSERT INTO tbl_product (id, id_type, nazev, dt_issue,dt_maturity) VALUES 	(seq_product.nextval,1,	'UNICREDIT SPA'	,null,null)	;
INSERT INTO tbl_product (id, id_type, nazev, dt_issue,dt_maturity) VALUES 	(seq_product.nextval,1,	'BANCA FARMAFACTORING SPA'	,null,null)	;
INSERT INTO tbl_product (id, id_type, nazev, dt_issue,dt_maturity) VALUES 	(seq_product.nextval,1,	'SAIPEM SPA'	,null,null)	;
INSERT INTO tbl_product (id, id_type, nazev, dt_issue,dt_maturity) VALUES 	(seq_product.nextval,1,	'UNICREDIT SPA RIGHTS 01/2018'	,null,null)	;
INSERT INTO tbl_product (id, id_type, nazev, dt_issue,dt_maturity) VALUES 	(seq_product.nextval,1,	'INTESA SANPAOLO-WTDRW RIGHT'	,null,null)	;
INSERT INTO tbl_product (id, id_type, nazev, dt_issue,dt_maturity) VALUES 	(seq_product.nextval,1,	'UNICREDIT SPA PLN'	,null,null)	;
INSERT INTO tbl_product (id, id_type, nazev, dt_issue,dt_maturity) VALUES 	(seq_product.nextval,1,	'UNICREDIT SPA PLN'	,null,null)	;
INSERT INTO tbl_product (id, id_type, nazev, dt_issue,dt_maturity) VALUES 	(seq_product.nextval,1,	'IVY Rosewood Diversified Feeder Fund Class A1 USD'	,null,null)	;
INSERT INTO tbl_product (id, id_type, nazev, dt_issue,dt_maturity) VALUES 	(seq_product.nextval,1,	'ETFS PHYSICAL PLATINUM'	,null,null)	;
INSERT INTO tbl_product (id, id_type, nazev, dt_issue,dt_maturity) VALUES 	(seq_product.nextval,1,	'ETFS PHYSICAL PALLADIUM'	,null,null)	;
INSERT INTO tbl_product (id, id_type, nazev, dt_issue,dt_maturity) VALUES 	(seq_product.nextval,1,	'ETFS PHYSICAL SILVER'	,null,null)	;
INSERT INTO tbl_product (id, id_type, nazev, dt_issue,dt_maturity) VALUES 	(seq_product.nextval,1,	'ETFS PHYSICAL GOLD'	,null,null)	;
INSERT INTO tbl_product (id, id_type, nazev, dt_issue,dt_maturity) VALUES 	(seq_product.nextval,1,	'ETFS PHYSICAL PM BASKET'	,null,null)	;
INSERT INTO tbl_product (id, id_type, nazev, dt_issue,dt_maturity) VALUES 	(seq_product.nextval,1,	'JPM LIGHTHOUSE Diversified Fund Certificate 5/7/2013'	,null,null)	;
INSERT INTO tbl_product (id, id_type, nazev, dt_issue,dt_maturity) VALUES 	(seq_product.nextval,1,	'ETFS SHORT COTTON ETC'	,null,null)	;
INSERT INTO tbl_product (id, id_type, nazev, dt_issue,dt_maturity) VALUES 	(seq_product.nextval,1,	'ETFS SHORT SILVER'	,null,null)	;
INSERT INTO tbl_product (id, id_type, nazev, dt_issue,dt_maturity) VALUES 	(seq_product.nextval,1,	'ETFS LONGER DT NATURAL GAS'	,null,null)	;
INSERT INTO tbl_product (id, id_type, nazev, dt_issue,dt_maturity) VALUES 	(seq_product.nextval,1,	'ETFS LONGER DATD AGRICULTURE'	,null,null)	;
INSERT INTO tbl_product (id, id_type, nazev, dt_issue,dt_maturity) VALUES 	(seq_product.nextval,1,	'ETFS DAILY LEVERAGED COFFEE'	,null,null)	;
INSERT INTO tbl_product (id, id_type, nazev, dt_issue,dt_maturity) VALUES 	(seq_product.nextval,1,	'ETFS 2X DAILY LONG COCOA'	,null,null)	;
INSERT INTO tbl_product (id, id_type, nazev, dt_issue,dt_maturity) VALUES 	(seq_product.nextval,1,	'SHIRE PLC - GBP'	,null,null)	;
INSERT INTO tbl_product (id, id_type, nazev, dt_issue,dt_maturity) VALUES 	(seq_product.nextval,1,	'ATRIUM EUROPEAN REAL ESTATE'	,null,null)	;
INSERT INTO tbl_product (id, id_type, nazev, dt_issue,dt_maturity) VALUES 	(seq_product.nextval,1,	'VELTI PLC'	,null,null)	;
INSERT INTO tbl_product (id, id_type, nazev, dt_issue,dt_maturity) VALUES 	(seq_product.nextval,1,	'GLENCORE PLC'	,null,null)	;
INSERT INTO tbl_product (id, id_type, nazev, dt_issue,dt_maturity) VALUES 	(seq_product.nextval,1,	'GENEL ENERGY PLC'	,null,null)	;
INSERT INTO tbl_product (id, id_type, nazev, dt_issue,dt_maturity) VALUES 	(seq_product.nextval,1,	'CENTAMIN PLC'	,null,null)	;
INSERT INTO tbl_product (id, id_type, nazev, dt_issue,dt_maturity) VALUES 	(seq_product.nextval,1,	'POLYMETAL INTERNATIONAL-W/I'	,null,null)	;
INSERT INTO tbl_product (id, id_type, nazev, dt_issue,dt_maturity) VALUES 	(seq_product.nextval,1,	'DELPHI TECHNOLOGIES PLC'	,null,null)	;
INSERT INTO tbl_product (id, id_type, nazev, dt_issue,dt_maturity) VALUES 	(seq_product.nextval,1,	'WPP PLC'	,null,null)	;
INSERT INTO tbl_product (id, id_type, nazev, dt_issue,dt_maturity) VALUES 	(seq_product.nextval,1,	'FERGUSON PLC'	,null,null)	;
INSERT INTO tbl_product (id, id_type, nazev, dt_issue,dt_maturity) VALUES 	(seq_product.nextval,1,	'WIZZ AIR HOLDINGS PLC'	,null,null)	;
INSERT INTO tbl_product (id, id_type, nazev, dt_issue,dt_maturity) VALUES 	(seq_product.nextval,1,	'CANON INC'	,null,null)	;
INSERT INTO tbl_product (id, id_type, nazev, dt_issue,dt_maturity) VALUES 	(seq_product.nextval,1,	'SEVEN  I HOLDINGS CO LTD'	,null,null)	;
INSERT INTO tbl_product (id, id_type, nazev, dt_issue,dt_maturity) VALUES 	(seq_product.nextval,1,	'TOKYO ELECTRIC POWER CO INC'	,null,null)	;
INSERT INTO tbl_product (id, id_type, nazev, dt_issue,dt_maturity) VALUES 	(seq_product.nextval,1,	'TOYOTA MOTOR CORP'	,null,null)	;
INSERT INTO tbl_product (id, id_type, nazev, dt_issue,dt_maturity) VALUES 	(seq_product.nextval,1,	'NISSAN MOTOR CO LTD'	,null,null)	;
INSERT INTO tbl_product (id, id_type, nazev, dt_issue,dt_maturity) VALUES 	(seq_product.nextval,1,	'NINTENDO CO LTD'	,null,null)	;
INSERT INTO tbl_product (id, id_type, nazev, dt_issue,dt_maturity) VALUES 	(seq_product.nextval,1,	'ASTELLAS PHARMA INC'	,null,null)	;
INSERT INTO tbl_product (id, id_type, nazev, dt_issue,dt_maturity) VALUES 	(seq_product.nextval,1,	'SAMSUNG ELECTRONIC CO LTD. KRW'	,null,null)	;
INSERT INTO tbl_product (id, id_type, nazev, dt_issue,dt_maturity) VALUES 	(seq_product.nextval,1,	'INDUSTRIAL BANK OF KOREA'	,null,null)	;
INSERT INTO tbl_product (id, id_type, nazev, dt_issue,dt_maturity) VALUES 	(seq_product.nextval,1,	'CELLTRION INC'	,null,null)	;
INSERT INTO tbl_product (id, id_type, nazev, dt_issue,dt_maturity) VALUES 	(seq_product.nextval,1,	'GRAND KOREA LEISURE CO LTD'	,null,null)	;
INSERT INTO tbl_product (id, id_type, nazev, dt_issue,dt_maturity) VALUES 	(seq_product.nextval,1,	'XIAOMI CORP-CLASS B USD'	,null,null)	;
INSERT INTO tbl_product (id, id_type, nazev, dt_issue,dt_maturity) VALUES 	(seq_product.nextval,1,	'CDC CORP CL A'	,null,null)	;
INSERT INTO tbl_product (id, id_type, nazev, dt_issue,dt_maturity) VALUES 	(seq_product.nextval,1,	'CHINA HIGH SPEED TRANSM. EQUIP.'	,null,null)	;
INSERT INTO tbl_product (id, id_type, nazev, dt_issue,dt_maturity) VALUES 	(seq_product.nextval,1,	'COASTAL ENERGY CO'	,null,null)	;
INSERT INTO tbl_product (id, id_type, nazev, dt_issue,dt_maturity) VALUES 	(seq_product.nextval,1,	'FANTASIA HOLDINGS GROUP CO. LTD'	,null,null)	;
INSERT INTO tbl_product (id, id_type, nazev, dt_issue,dt_maturity) VALUES 	(seq_product.nextval,1,	'FABRINET'	,null,null)	;
INSERT INTO tbl_product (id, id_type, nazev, dt_issue,dt_maturity) VALUES 	(seq_product.nextval,1,	'GCL-POLY ENERGY HOLDINGS LTD'	,null,null)	;
INSERT INTO tbl_product (id, id_type, nazev, dt_issue,dt_maturity) VALUES 	(seq_product.nextval,1,	'GOTTEX ABI Fund'	,null,null)	;
INSERT INTO tbl_product (id, id_type, nazev, dt_issue,dt_maturity) VALUES 	(seq_product.nextval,1,	'HERBALIFE LTD.'	,null,null)	;
INSERT INTO tbl_product (id, id_type, nazev, dt_issue,dt_maturity) VALUES 	(seq_product.nextval,1,	'Man Style Selection SPC - Man Four Season Strategies'	,null,null)	;
INSERT INTO tbl_product (id, id_type, nazev, dt_issue,dt_maturity) VALUES 	(seq_product.nextval,1,	'NOBLE CORP OLD 2009'	,null,null)	;
INSERT INTO tbl_product (id, id_type, nazev, dt_issue,dt_maturity) VALUES 	(seq_product.nextval,1,	'OLYMPIA SPEC OPPORT CLASS B  EUR'	,null,null)	;
INSERT INTO tbl_product (id, id_type, nazev, dt_issue,dt_maturity) VALUES 	(seq_product.nextval,1,	'OPUS CREDIT  LTD CLASS B1 EUR'	,null,null)	;
INSERT INTO tbl_product (id, id_type, nazev, dt_issue,dt_maturity) VALUES 	(seq_product.nextval,1,	'OPUS CREDIT FUND LTD SP1 EUR'	,null,null)	;
INSERT INTO tbl_product (id, id_type, nazev, dt_issue,dt_maturity) VALUES 	(seq_product.nextval,1,	'OPUS CREDIT FUND LTD SP2 EUR'	,null,null)	;
INSERT INTO tbl_product (id, id_type, nazev, dt_issue,dt_maturity) VALUES 	(seq_product.nextval,1,	'OPUS Fund Limited Class B Shares'	,null,null)	;
INSERT INTO tbl_product (id, id_type, nazev, dt_issue,dt_maturity) VALUES 	(seq_product.nextval,1,	'PEAK SPORT PRODUCTS LTD.'	,null,null)	;
INSERT INTO tbl_product (id, id_type, nazev, dt_issue,dt_maturity) VALUES 	(seq_product.nextval,1,	'SANDS CHINA LTD.'	,null,null)	;
INSERT INTO tbl_product (id, id_type, nazev, dt_issue,dt_maturity) VALUES 	(seq_product.nextval,1,	'SCOTTISH RE GROUP'	,null,null)	;
INSERT INTO tbl_product (id, id_type, nazev, dt_issue,dt_maturity) VALUES 	(seq_product.nextval,1,	'SINA CORP'	,null,null)	;
INSERT INTO tbl_product (id, id_type, nazev, dt_issue,dt_maturity) VALUES 	(seq_product.nextval,1,	'TRANSOCEAN INC.'	,null,null)	;
INSERT INTO tbl_product (id, id_type, nazev, dt_issue,dt_maturity) VALUES 	(seq_product.nextval,1,	'TRANSOCEAN INC'	,null,null)	;
INSERT INTO tbl_product (id, id_type, nazev, dt_issue,dt_maturity) VALUES 	(seq_product.nextval,1,	'XINGDA INTERNATIONAL HOLDINGS LT'	,null,null)	;
INSERT INTO tbl_product (id, id_type, nazev, dt_issue,dt_maturity) VALUES 	(seq_product.nextval,1,	'XINYI SOLAR HOLDINGS LTD'	,null,null)	;
INSERT INTO tbl_product (id, id_type, nazev, dt_issue,dt_maturity) VALUES 	(seq_product.nextval,1,	'XIAOMI CORP-CLASS B'	,null,null)	;
INSERT INTO tbl_product (id, id_type, nazev, dt_issue,dt_maturity) VALUES 	(seq_product.nextval,1,	'OPUS Fund Limited Class S Shares'	,null,null)	;
INSERT INTO tbl_product (id, id_type, nazev, dt_issue,dt_maturity) VALUES 	(seq_product.nextval,1,	'KAZKOMMERTSBANK'	,null,null)	;
INSERT INTO tbl_product (id, id_type, nazev, dt_issue,dt_maturity) VALUES 	(seq_product.nextval,1,	'HALYK SAVINGS BANK OF KAZAKHSTAN'	,null,null)	;
INSERT INTO tbl_product (id, id_type, nazev, dt_issue,dt_maturity) VALUES 	(seq_product.nextval,1,	'BANK TURANALEM JSC'	,null,null)	;
INSERT INTO tbl_product (id, id_type, nazev, dt_issue,dt_maturity) VALUES 	(seq_product.nextval,1,	'BANK CENTERCREDIT'	,null,null)	;
INSERT INTO tbl_product (id, id_type, nazev, dt_issue,dt_maturity) VALUES 	(seq_product.nextval,1,	'EXCEL MARITIME CARRIERS LTD'	,null,null)	;
INSERT INTO tbl_product (id, id_type, nazev, dt_issue,dt_maturity) VALUES 	(seq_product.nextval,1,	'ROYAL CARIBBEAN CRUISES LTD'	,null,null)	;
INSERT INTO tbl_product (id, id_type, nazev, dt_issue,dt_maturity) VALUES 	(seq_product.nextval,1,	'JB GLOBAL CONVERT BOND FUND B'	,null,null)	;
INSERT INTO tbl_product (id, id_type, nazev, dt_issue,dt_maturity) VALUES 	(seq_product.nextval,1,	'JB GLOBAL CONVERT BOND FUND A'	,null,null)	;
INSERT INTO tbl_product (id, id_type, nazev, dt_issue,dt_maturity) VALUES 	(seq_product.nextval,1,	'JB EURO CASH FUND-B'	,null,null)	;
INSERT INTO tbl_product (id, id_type, nazev, dt_issue,dt_maturity) VALUES 	(seq_product.nextval,1,	'FIDELITY FUNDS-EMERGING MARKETS'	,null,null)	;
INSERT INTO tbl_product (id, id_type, nazev, dt_issue,dt_maturity) VALUES 	(seq_product.nextval,1,	'FIDELITY FUND-GREAT CHINA FUND'	,null,null)	;
INSERT INTO tbl_product (id, id_type, nazev, dt_issue,dt_maturity) VALUES 	(seq_product.nextval,1,	'FIDELITY FUND-SOUTH EAST ASIA FUND'	,null,null)	;
INSERT INTO tbl_product (id, id_type, nazev, dt_issue,dt_maturity) VALUES 	(seq_product.nextval,1,	'FIDELITY FUND-THAILAND FUND-A'	,null,null)	;
INSERT INTO tbl_product (id, id_type, nazev, dt_issue,dt_maturity) VALUES 	(seq_product.nextval,1,	'FIDELITY FUND-LATIN AMERICA FUND'	,null,null)	;
INSERT INTO tbl_product (id, id_type, nazev, dt_issue,dt_maturity) VALUES 	(seq_product.nextval,1,	'ABN AMRO-EUR-E-A - NEPOUZIVAT !!!'	,null,null)	;
INSERT INTO tbl_product (id, id_type, nazev, dt_issue,dt_maturity) VALUES 	(seq_product.nextval,1,	'FIDELITY FUNDS-ASIAN SPEC.SIT.F.'	,null,null)	;
INSERT INTO tbl_product (id, id_type, nazev, dt_issue,dt_maturity) VALUES 	(seq_product.nextval,1,	'CS-EF (L)USA-B'	,null,null)	;


INSERT INTO tbl_product (id, id_type, nazev, dt_issue,dt_maturity) VALUES 	(seq_product.nextval,2,	'GOLDMAN SACHS L+111 19/06/2028'	,  to_date('	2018-06-19	', 'yyyy-mm-dd'), to_date('	2028-06-19	', 'yyyy-mm-dd'))	;
INSERT INTO tbl_product (id, id_type, nazev, dt_issue,dt_maturity) VALUES 	(seq_product.nextval,2,	'HZL ERSTE JELZALOGBANK 1.5 24/11/2023'	,  to_date('	2018-06-20	', 'yyyy-mm-dd'), to_date('	2023-11-24	', 'yyyy-mm-dd'))	;
INSERT INTO tbl_product (id, id_type, nazev, dt_issue,dt_maturity) VALUES 	(seq_product.nextval,2,	'HZL MBANK HIPO L+58 10/06/2024'	,  to_date('	2018-06-22	', 'yyyy-mm-dd'), to_date('	2024-06-10	', 'yyyy-mm-dd'))	;
INSERT INTO tbl_product (id, id_type, nazev, dt_issue,dt_maturity) VALUES 	(seq_product.nextval,2,	'ALBERTSONS COS 0 01/15/24'	,  to_date('	2018-06-25	', 'yyyy-mm-dd'), to_date('	2024-01-15	', 'yyyy-mm-dd'))	;
INSERT INTO tbl_product (id, id_type, nazev, dt_issue,dt_maturity) VALUES 	(seq_product.nextval,2,	'HUNGARY GOVT 2.5 24/10/2024'	,  to_date('	2018-06-27	', 'yyyy-mm-dd'), to_date('	2024-10-24	', 'yyyy-mm-dd'))	;
INSERT INTO tbl_product (id, id_type, nazev, dt_issue,dt_maturity) VALUES 	(seq_product.nextval,2,	'DEKINVEST Alfa L+220 27/06/2023'	,  to_date('	2018-06-27	', 'yyyy-mm-dd'), to_date('	2023-06-27	', 'yyyy-mm-dd'))	;
INSERT INTO tbl_product (id, id_type, nazev, dt_issue,dt_maturity) VALUES 	(seq_product.nextval,2,	'US TREASURY 2.5 30/06/2020'	,  to_date('	2018-06-30	', 'yyyy-mm-dd'), to_date('	2020-06-30	', 'yyyy-mm-dd'))	;
INSERT INTO tbl_product (id, id_type, nazev, dt_issue,dt_maturity) VALUES 	(seq_product.nextval,2,	'DKT FINANCE APS DKTFIN 9 3/8 06/17/23'	,  to_date('	2018-07-02	', 'yyyy-mm-dd'), to_date('	2023-06-17	', 'yyyy-mm-dd'))	;
INSERT INTO tbl_product (id, id_type, nazev, dt_issue,dt_maturity) VALUES 	(seq_product.nextval,2,	'DKT FINANCE APS DKTFIN 7 06/17/23'	,  to_date('	2018-07-02	', 'yyyy-mm-dd'), to_date('	2023-06-17	', 'yyyy-mm-dd'))	;
INSERT INTO tbl_product (id, id_type, nazev, dt_issue,dt_maturity) VALUES 	(seq_product.nextval,2,	'SUPERIOR PLUS 7 07/15/26'	,  to_date('	2018-07-03	', 'yyyy-mm-dd'), to_date('	2026-07-15	', 'yyyy-mm-dd'))	;
INSERT INTO tbl_product (id, id_type, nazev, dt_issue,dt_maturity) VALUES 	(seq_product.nextval,2,	'ENERGIZER GAMMA ACQUISITION INC ENR 6 3/8 07/15/26'	,  to_date('	2018-07-06	', 'yyyy-mm-dd'), to_date('	2026-07-15	', 'yyyy-mm-dd'))	;
INSERT INTO tbl_product (id, id_type, nazev, dt_issue,dt_maturity) VALUES 	(seq_product.nextval,2,	'RAIFFEISEN BK INT 4.75 06/07/2021'	,  to_date('	2018-07-06	', 'yyyy-mm-dd'), to_date('	2021-07-06	', 'yyyy-mm-dd'))	;
INSERT INTO tbl_product (id, id_type, nazev, dt_issue,dt_maturity) VALUES 	(seq_product.nextval,2,	'Banco Santarder L+53 11/07/2025'	,  to_date('	2018-07-11	', 'yyyy-mm-dd'), to_date('	2025-07-11	', 'yyyy-mm-dd'))	;
INSERT INTO tbl_product (id, id_type, nazev, dt_issue,dt_maturity) VALUES 	(seq_product.nextval,2,	'EPH FINANCING L+200 16/07/2022'	,  to_date('	2018-07-16	', 'yyyy-mm-dd'), to_date('	2022-07-16	', 'yyyy-mm-dd'))	;
INSERT INTO tbl_product (id, id_type, nazev, dt_issue,dt_maturity) VALUES 	(seq_product.nextval,2,	'SIMMONS FOODS 7 3/4 01/15/24'	,  to_date('	2018-07-18	', 'yyyy-mm-dd'), to_date('	2024-01-15	', 'yyyy-mm-dd'))	;
INSERT INTO tbl_product (id, id_type, nazev, dt_issue,dt_maturity) VALUES 	(seq_product.nextval,2,	'OTE HTOGA 2.375 18/7/2022'	,  to_date('	2018-07-18	', 'yyyy-mm-dd'), to_date('	2022-07-18	', 'yyyy-mm-dd'))	;
INSERT INTO tbl_product (id, id_type, nazev, dt_issue,dt_maturity) VALUES 	(seq_product.nextval,2,	'FIKTIVNI GBU.N 0.6386 18/7/2022'	,  to_date('	2018-07-18	', 'yyyy-mm-dd'), to_date('	2022-07-18	', 'yyyy-mm-dd'))	;
INSERT INTO tbl_product (id, id_type, nazev, dt_issue,dt_maturity) VALUES 	(seq_product.nextval,2,	'TRANSOCEAN PONTUS LTD RIG 6 1/8 08/01/25'	,  to_date('	2018-07-20	', 'yyyy-mm-dd'), to_date('	2025-08-01	', 'yyyy-mm-dd'))	;
INSERT INTO tbl_product (id, id_type, nazev, dt_issue,dt_maturity) VALUES 	(seq_product.nextval,2,	'ANTARES HOLDINGS 6 08/15/23'	,  to_date('	2018-07-26	', 'yyyy-mm-dd'), to_date('	2023-08-15	', 'yyyy-mm-dd'))	;
INSERT INTO tbl_product (id, id_type, nazev, dt_issue,dt_maturity) VALUES 	(seq_product.nextval,2,	'DBR GOV ZERO 13/10/2023'	,  to_date('	2018-07-27	', 'yyyy-mm-dd'), to_date('	2023-10-13	', 'yyyy-mm-dd'))	;
INSERT INTO tbl_product (id, id_type, nazev, dt_issue,dt_maturity) VALUES 	(seq_product.nextval,2,	'HZL PKO BANK HIPOTECZNY L+62 25/07/2025'	,  to_date('	2018-07-27	', 'yyyy-mm-dd'), to_date('	2025-07-25	', 'yyyy-mm-dd'))	;
INSERT INTO tbl_product (id, id_type, nazev, dt_issue,dt_maturity) VALUES 	(seq_product.nextval,2,	'ALTICE FRANCE 8,125 02/01/27'	,  to_date('	2018-07-31	', 'yyyy-mm-dd'), to_date('	2027-02-01	', 'yyyy-mm-dd'))	;
INSERT INTO tbl_product (id, id_type, nazev, dt_issue,dt_maturity) VALUES 	(seq_product.nextval,2,	'US TREASURY 2.875 31/07/2025'	,  to_date('	2018-07-31	', 'yyyy-mm-dd'), to_date('	2025-07-31	', 'yyyy-mm-dd'))	;
INSERT INTO tbl_product (id, id_type, nazev, dt_issue,dt_maturity) VALUES 	(seq_product.nextval,2,	'SINO OCEAN LAND L+230 31/07/2021'	,  to_date('	2018-07-31	', 'yyyy-mm-dd'), to_date('	2021-07-31	', 'yyyy-mm-dd'))	;
INSERT INTO tbl_product (id, id_type, nazev, dt_issue,dt_maturity) VALUES 	(seq_product.nextval,2,	'FIKTIVNI GPRE CZK 2.22223 2/8/2021'	,  to_date('	2018-08-02	', 'yyyy-mm-dd'), to_date('	2021-08-02	', 'yyyy-mm-dd'))	;
INSERT INTO tbl_product (id, id_type, nazev, dt_issue,dt_maturity) VALUES 	(seq_product.nextval,2,	'FIKTIVNI GPRE CZK 2.30471 2/8/2022'	,  to_date('	2018-08-02	', 'yyyy-mm-dd'), to_date('	2022-08-02	', 'yyyy-mm-dd'))	;
INSERT INTO tbl_product (id, id_type, nazev, dt_issue,dt_maturity) VALUES 	(seq_product.nextval,2,	'PARTY CITY HLDG 6 5/8 08/01/26'	,  to_date('	2018-08-02	', 'yyyy-mm-dd'), to_date('	2026-08-01	', 'yyyy-mm-dd'))	;
INSERT INTO tbl_product (id, id_type, nazev, dt_issue,dt_maturity) VALUES 	(seq_product.nextval,2,	'MASON FINAN SUB 6,875 08/15/23'	,  to_date('	2018-08-06	', 'yyyy-mm-dd'), to_date('	2023-08-15	', 'yyyy-mm-dd'))	;
INSERT INTO tbl_product (id, id_type, nazev, dt_issue,dt_maturity) VALUES 	(seq_product.nextval,2,	'FS ENERGY  POWR 7 1/2 08/15/23'	,  to_date('	2018-08-16	', 'yyyy-mm-dd'), to_date('	2023-08-15	', 'yyyy-mm-dd'))	;
INSERT INTO tbl_product (id, id_type, nazev, dt_issue,dt_maturity) VALUES 	(seq_product.nextval,2,	'HLF FIN SARL LLC 7 1/4 08/15/26'	,  to_date('	2018-08-16	', 'yyyy-mm-dd'), to_date('	2026-08-15	', 'yyyy-mm-dd'))	;
INSERT INTO tbl_product (id, id_type, nazev, dt_issue,dt_maturity) VALUES 	(seq_product.nextval,2,	'VW LEASING 0.25 16/02/2021'	,  to_date('	2018-08-16	', 'yyyy-mm-dd'), to_date('	2021-02-16	', 'yyyy-mm-dd'))	;
INSERT INTO tbl_product (id, id_type, nazev, dt_issue,dt_maturity) VALUES 	(seq_product.nextval,2,	'MARRIOTT OWNERSH 6 1/2 09/15/26'	,  to_date('	2018-08-23	', 'yyyy-mm-dd'), to_date('	2026-09-15	', 'yyyy-mm-dd'))	;
INSERT INTO tbl_product (id, id_type, nazev, dt_issue,dt_maturity) VALUES 	(seq_product.nextval,2,	'BKO GOV 0 11/09/2020'	,  to_date('	2018-08-23	', 'yyyy-mm-dd'), to_date('	2020-09-11	', 'yyyy-mm-dd'))	;
INSERT INTO tbl_product (id, id_type, nazev, dt_issue,dt_maturity) VALUES 	(seq_product.nextval,2,	'US TREASURY 2.75 31/08/2025'	,  to_date('	2018-08-31	', 'yyyy-mm-dd'), to_date('	2025-08-31	', 'yyyy-mm-dd'))	;
INSERT INTO tbl_product (id, id_type, nazev, dt_issue,dt_maturity) VALUES 	(seq_product.nextval,2,	'BARCLAYS PLC 1.5 03/09/2023'	,  to_date('	2018-09-03	', 'yyyy-mm-dd'), to_date('	2023-09-03	', 'yyyy-mm-dd'))	;
INSERT INTO tbl_product (id, id_type, nazev, dt_issue,dt_maturity) VALUES 	(seq_product.nextval,2,	'MBANK 1.058 05/09/2022'	,  to_date('	2018-09-05	', 'yyyy-mm-dd'), to_date('	2022-09-05	', 'yyyy-mm-dd'))	;
INSERT INTO tbl_product (id, id_type, nazev, dt_issue,dt_maturity) VALUES 	(seq_product.nextval,2,	'ATRIUM EUR. 3 11/9/2025'	,  to_date('	2018-09-11	', 'yyyy-mm-dd'), to_date('	2025-09-11	', 'yyyy-mm-dd'))	;
INSERT INTO tbl_product (id, id_type, nazev, dt_issue,dt_maturity) VALUES 	(seq_product.nextval,2,	'HUNGARIAN DEVELOPMENT BA 1.7 27/10/2021'	,  to_date('	2018-09-19	', 'yyyy-mm-dd'), to_date('	2021-10-27	', 'yyyy-mm-dd'))	;
INSERT INTO tbl_product (id, id_type, nazev, dt_issue,dt_maturity) VALUES 	(seq_product.nextval,2,	'Santander Bank Polska 0.75 20/09/2021'	,  to_date('	2018-09-20	', 'yyyy-mm-dd'), to_date('	2021-09-20	', 'yyyy-mm-dd'))	;
INSERT INTO tbl_product (id, id_type, nazev, dt_issue,dt_maturity) VALUES 	(seq_product.nextval,2,	'US TREASURY 2.75 30/09/2020'	,  to_date('	2018-09-30	', 'yyyy-mm-dd'), to_date('	2020-09-30	', 'yyyy-mm-dd'))	;
INSERT INTO tbl_product (id, id_type, nazev, dt_issue,dt_maturity) VALUES 	(seq_product.nextval,2,	'US TREASURY 3 30/09/2025'	,  to_date('	2018-09-30	', 'yyyy-mm-dd'), to_date('	2025-09-30	', 'yyyy-mm-dd'))	;
INSERT INTO tbl_product (id, id_type, nazev, dt_issue,dt_maturity) VALUES 	(seq_product.nextval,2,	'STEVENS HOLDING 6,125 10/01/26'	,  to_date('	2018-10-01	', 'yyyy-mm-dd'), to_date('	2026-10-01	', 'yyyy-mm-dd'))	;
INSERT INTO tbl_product (id, id_type, nazev, dt_issue,dt_maturity) VALUES 	(seq_product.nextval,2,	'FINANCIAL  RISK 6 1/4 05/15/26'	,  to_date('	2018-10-01	', 'yyyy-mm-dd'), to_date('	2026-05-15	', 'yyyy-mm-dd'))	;
INSERT INTO tbl_product (id, id_type, nazev, dt_issue,dt_maturity) VALUES 	(seq_product.nextval,2,	'HUNGARY GOVT 1.25 22/10/2025'	,  to_date('	2018-10-02	', 'yyyy-mm-dd'), to_date('	2025-10-22	', 'yyyy-mm-dd'))	;
INSERT INTO tbl_product (id, id_type, nazev, dt_issue,dt_maturity) VALUES 	(seq_product.nextval,2,	'ROMANIA GB 2.875 11/03/2029 EUR'	,  to_date('	2018-10-11	', 'yyyy-mm-dd'), to_date('	2029-03-11	', 'yyyy-mm-dd'))	;
INSERT INTO tbl_product (id, id_type, nazev, dt_issue,dt_maturity) VALUES 	(seq_product.nextval,2,	'CW SR FINANCING 7 1/2 10/15/26'	,  to_date('	2018-10-11	', 'yyyy-mm-dd'), to_date('	2026-10-15	', 'yyyy-mm-dd'))	;
INSERT INTO tbl_product (id, id_type, nazev, dt_issue,dt_maturity) VALUES 	(seq_product.nextval,2,	'INTERTAPE POLYMR 7 10/15/26'	,  to_date('	2018-10-15	', 'yyyy-mm-dd'), to_date('	2026-10-15	', 'yyyy-mm-dd'))	;
INSERT INTO tbl_product (id, id_type, nazev, dt_issue,dt_maturity) VALUES 	(seq_product.nextval,2,	'BANK PEKAO L+155 16/10/2028 SUB C23'	,  to_date('	2018-10-15	', 'yyyy-mm-dd'), to_date('	2028-10-16	', 'yyyy-mm-dd'))	;
INSERT INTO tbl_product (id, id_type, nazev, dt_issue,dt_maturity) VALUES 	(seq_product.nextval,2,	'W  T OFFSHORE 9 3/4 11/01/23'	,  to_date('	2018-10-18	', 'yyyy-mm-dd'), to_date('	2023-11-01	', 'yyyy-mm-dd'))	;
INSERT INTO tbl_product (id, id_type, nazev, dt_issue,dt_maturity) VALUES 	(seq_product.nextval,2,	'RESIDEO FUNDING 6 1/8 11/01/26'	,  to_date('	2018-10-19	', 'yyyy-mm-dd'), to_date('	2026-11-01	', 'yyyy-mm-dd'))	;
INSERT INTO tbl_product (id, id_type, nazev, dt_issue,dt_maturity) VALUES 	(seq_product.nextval,2,	'PETROLEOS MEXICA 6 1/2 01/23/29'	,  to_date('	2018-10-23	', 'yyyy-mm-dd'), to_date('	2029-01-23	', 'yyyy-mm-dd'))	;
INSERT INTO tbl_product (id, id_type, nazev, dt_issue,dt_maturity) VALUES 	(seq_product.nextval,2,	'JT GLOBAL FINANCE IX 4.0 26/10/2023'	,  to_date('	2018-10-26	', 'yyyy-mm-dd'), to_date('	2023-10-26	', 'yyyy-mm-dd'))	;
INSERT INTO tbl_product (id, id_type, nazev, dt_issue,dt_maturity) VALUES 	(seq_product.nextval,2,	'HZL PKO BANK HIPOTECZNY L+66 28/04/2025'	,  to_date('	2018-10-26	', 'yyyy-mm-dd'), to_date('	2025-04-28	', 'yyyy-mm-dd'))	;
INSERT INTO tbl_product (id, id_type, nazev, dt_issue,dt_maturity) VALUES 	(seq_product.nextval,2,	'US TREASURY 3 31/10/2025'	,  to_date('	2018-10-31	', 'yyyy-mm-dd'), to_date('	2025-10-31	', 'yyyy-mm-dd'))	;
INSERT INTO tbl_product (id, id_type, nazev, dt_issue,dt_maturity) VALUES 	(seq_product.nextval,2,	'RAIFFEISEN BK INT 3.4 13/11/2023'	,  to_date('	2018-11-13	', 'yyyy-mm-dd'), to_date('	2023-11-13	', 'yyyy-mm-dd'))	;
INSERT INTO tbl_product (id, id_type, nazev, dt_issue,dt_maturity) VALUES 	(seq_product.nextval,2,	'BKO GOV 0 11/12/2020'	,  to_date('	2018-11-15	', 'yyyy-mm-dd'), to_date('	2020-12-11	', 'yyyy-mm-dd'))	;
INSERT INTO tbl_product (id, id_type, nazev, dt_issue,dt_maturity) VALUES 	(seq_product.nextval,2,	'POLGB 0 25/05/2021'	,  to_date('	2018-11-19	', 'yyyy-mm-dd'), to_date('	2021-05-25	', 'yyyy-mm-dd'))	;
INSERT INTO tbl_product (id, id_type, nazev, dt_issue,dt_maturity) VALUES 	(seq_product.nextval,2,	'FIKTIVNI BOND STRIP 26/11/19-22'	,  to_date('	2018-11-26	', 'yyyy-mm-dd'), to_date('	2022-11-26	', 'yyyy-mm-dd'))	;
INSERT INTO tbl_product (id, id_type, nazev, dt_issue,dt_maturity) VALUES 	(seq_product.nextval,2,	'CITIGROUP L+50 10/12/2021'	,  to_date('	2018-12-10	', 'yyyy-mm-dd'), to_date('	2021-12-10	', 'yyyy-mm-dd'))	;
INSERT INTO tbl_product (id, id_type, nazev, dt_issue,dt_maturity) VALUES 	(seq_product.nextval,2,	'CITIGROUP 4.4 10/12/2021'	,  to_date('	2018-12-10	', 'yyyy-mm-dd'), to_date('	2021-12-10	', 'yyyy-mm-dd'))	;
INSERT INTO tbl_product (id, id_type, nazev, dt_issue,dt_maturity) VALUES 	(seq_product.nextval,2,	'Black Sea TD Bank 4.9 11/12/2021'	,  to_date('	2018-12-11	', 'yyyy-mm-dd'), to_date('	2021-12-11	', 'yyyy-mm-dd'))	;
INSERT INTO tbl_product (id, id_type, nazev, dt_issue,dt_maturity) VALUES 	(seq_product.nextval,2,	'SID BANKA 0.5 12/12/2023'	,  to_date('	2018-12-12	', 'yyyy-mm-dd'), to_date('	2023-12-12	', 'yyyy-mm-dd'))	;


INSERT INTO tbl_portfolio (id, jmeno, prijmeni, ulice, mesto) VALUES 	(seq_portfolio.nextval,		'Jan '	,	'Novk'	,	'ehoova 10'	,	'Praha'	);
INSERT INTO tbl_portfolio (id, jmeno, prijmeni, ulice, mesto) VALUES 	(seq_portfolio.nextval,		'Petr'	,	'Chalupa'	,	'Spolovsk 15'	,	'Praha'	);
INSERT INTO tbl_portfolio (id, jmeno, prijmeni, ulice, mesto) VALUES 	(seq_portfolio.nextval,		'Nora'	,	'Svobodov'	,	'Svobodova 6'	,	'Praha'	);
INSERT INTO tbl_portfolio (id, jmeno, prijmeni, ulice, mesto) VALUES 	(seq_portfolio.nextval,		'Ivana'	,	'Chlupov'	,	'Beneova 10'	,	'Praha'	);
INSERT INTO tbl_portfolio (id, jmeno, prijmeni, ulice, mesto) VALUES 	(seq_portfolio.nextval,		'Petr'	,	'Bene'	,	'Chlupova 3'	,	'Brno'	);

insert into tbl_order (id,dt_prikazu) values	(seq_order.nextval,	to_date('	2018-01-01	', 'yyyy-mm-dd')	);
insert into tbl_order (id,dt_prikazu) values	(seq_order.nextval,	to_date('	2018-01-03	', 'yyyy-mm-dd')	);
insert into tbl_order (id,dt_prikazu) values	(seq_order.nextval,	to_date('	2018-01-05	', 'yyyy-mm-dd')	);
insert into tbl_order (id,dt_prikazu) values	(seq_order.nextval,	to_date('	2018-01-07	', 'yyyy-mm-dd')	);
insert into tbl_order (id,dt_prikazu) values	(seq_order.nextval,	to_date('	2018-01-09	', 'yyyy-mm-dd')	);
insert into tbl_order (id,dt_prikazu) values	(seq_order.nextval,	to_date('	2018-01-11	', 'yyyy-mm-dd')	);
insert into tbl_order (id,dt_prikazu) values	(seq_order.nextval,	to_date('	2018-01-13	', 'yyyy-mm-dd')	);
insert into tbl_order (id,dt_prikazu) values	(seq_order.nextval,	to_date('	2018-01-15	', 'yyyy-mm-dd')	);
insert into tbl_order (id,dt_prikazu) values	(seq_order.nextval,	to_date('	2018-01-17	', 'yyyy-mm-dd')	);
insert into tbl_order (id,dt_prikazu) values	(seq_order.nextval,	to_date('	2018-01-19	', 'yyyy-mm-dd')	);
insert into tbl_order (id,dt_prikazu) values	(seq_order.nextval,	to_date('	2018-01-21	', 'yyyy-mm-dd')	);
insert into tbl_order (id,dt_prikazu) values	(seq_order.nextval,	to_date('	2018-01-23	', 'yyyy-mm-dd')	);
insert into tbl_order (id,dt_prikazu) values	(seq_order.nextval,	to_date('	2018-01-25	', 'yyyy-mm-dd')	);
insert into tbl_order (id,dt_prikazu) values	(seq_order.nextval,	to_date('	2018-01-27	', 'yyyy-mm-dd')	);
insert into tbl_order (id,dt_prikazu) values	(seq_order.nextval,	to_date('	2018-01-29	', 'yyyy-mm-dd')	);

insert into tbl_deal (id,id_order,id_portfolio,id_product,id_type,cena_jednotkova,cena_celkova,pocet_kusu) values	(seq_deal.nextval,	1	,	1	,	1	,	1	,	1	,	100000000	,	100000000	);
insert into tbl_deal (id,id_order,id_portfolio,id_product,id_type,cena_jednotkova,cena_celkova,pocet_kusu) values	(seq_deal.nextval,	1	,	2	,	1	,	1	,	1	,	100000000	,	100000000	);
insert into tbl_deal (id,id_order,id_portfolio,id_product,id_type,cena_jednotkova,cena_celkova,pocet_kusu) values	(seq_deal.nextval,	1	,	3	,	1	,	1	,	1	,	100000000	,	100000000	);
insert into tbl_deal (id,id_order,id_portfolio,id_product,id_type,cena_jednotkova,cena_celkova,pocet_kusu) values	(seq_deal.nextval,	1	,	4	,	1	,	1	,	1	,	100000000	,	100000000	);
insert into tbl_deal (id,id_order,id_portfolio,id_product,id_type,cena_jednotkova,cena_celkova,pocet_kusu) values	(seq_deal.nextval,	1	,	5	,	1	,	1	,	1	,	100000000	,	100000000	);

insert into tbl_deal (id,id_order,id_portfolio,id_product,id_type,cena_jednotkova,cena_celkova,pocet_kusu) values	(seq_deal.nextval,	1	,	1	,	2	,	3	,	13	,	169	,	13	);	insert into tbl_deal (id,id_order,id_portfolio,id_product,id_type,cena_jednotkova,cena_celkova,pocet_kusu) values	(seq_deal.nextval,	1	,	1	,	1	,	4	,	1	,	-169	,	-169	);
insert into tbl_deal (id,id_order,id_portfolio,id_product,id_type,cena_jednotkova,cena_celkova,pocet_kusu) values	(seq_deal.nextval,	1	,	1	,	2	,	3	,	10	,	100	,	10	);	insert into tbl_deal (id,id_order,id_portfolio,id_product,id_type,cena_jednotkova,cena_celkova,pocet_kusu) values	(seq_deal.nextval,	1	,	1	,	1	,	4	,	1	,	-100	,	-100	);
insert into tbl_deal (id,id_order,id_portfolio,id_product,id_type,cena_jednotkova,cena_celkova,pocet_kusu) values	(seq_deal.nextval,	1	,	1	,	2	,	3	,	14	,	154	,	11	);	insert into tbl_deal (id,id_order,id_portfolio,id_product,id_type,cena_jednotkova,cena_celkova,pocet_kusu) values	(seq_deal.nextval,	1	,	1	,	1	,	4	,	1	,	-154	,	-154	);
insert into tbl_deal (id,id_order,id_portfolio,id_product,id_type,cena_jednotkova,cena_celkova,pocet_kusu) values	(seq_deal.nextval,	1	,	1	,	3	,	3	,	14	,	182	,	13	);	insert into tbl_deal (id,id_order,id_portfolio,id_product,id_type,cena_jednotkova,cena_celkova,pocet_kusu) values	(seq_deal.nextval,	1	,	1	,	1	,	4	,	1	,	-182	,	-182	);
insert into tbl_deal (id,id_order,id_portfolio,id_product,id_type,cena_jednotkova,cena_celkova,pocet_kusu) values	(seq_deal.nextval,	1	,	1	,	3	,	3	,	14	,	140	,	10	);	insert into tbl_deal (id,id_order,id_portfolio,id_product,id_type,cena_jednotkova,cena_celkova,pocet_kusu) values	(seq_deal.nextval,	1	,	1	,	1	,	4	,	1	,	-140	,	-140	);
insert into tbl_deal (id,id_order,id_portfolio,id_product,id_type,cena_jednotkova,cena_celkova,pocet_kusu) values	(seq_deal.nextval,	1	,	1	,	3	,	3	,	10	,	120	,	12	);	insert into tbl_deal (id,id_order,id_portfolio,id_product,id_type,cena_jednotkova,cena_celkova,pocet_kusu) values	(seq_deal.nextval,	1	,	1	,	1	,	4	,	1	,	-120	,	-120	);
insert into tbl_deal (id,id_order,id_portfolio,id_product,id_type,cena_jednotkova,cena_celkova,pocet_kusu) values	(seq_deal.nextval,	1	,	1	,	3	,	3	,	12	,	120	,	10	);	insert into tbl_deal (id,id_order,id_portfolio,id_product,id_type,cena_jednotkova,cena_celkova,pocet_kusu) values	(seq_deal.nextval,	1	,	1	,	1	,	4	,	1	,	-120	,	-120	);
insert into tbl_deal (id,id_order,id_portfolio,id_product,id_type,cena_jednotkova,cena_celkova,pocet_kusu) values	(seq_deal.nextval,	1	,	1	,	3	,	3	,	12	,	120	,	10	);	insert into tbl_deal (id,id_order,id_portfolio,id_product,id_type,cena_jednotkova,cena_celkova,pocet_kusu) values	(seq_deal.nextval,	1	,	1	,	1	,	4	,	1	,	-120	,	-120	);
insert into tbl_deal (id,id_order,id_portfolio,id_product,id_type,cena_jednotkova,cena_celkova,pocet_kusu) values	(seq_deal.nextval,	1	,	1	,	4	,	3	,	13	,	130	,	10	);	insert into tbl_deal (id,id_order,id_portfolio,id_product,id_type,cena_jednotkova,cena_celkova,pocet_kusu) values	(seq_deal.nextval,	1	,	1	,	1	,	4	,	1	,	-130	,	-130	);
insert into tbl_deal (id,id_order,id_portfolio,id_product,id_type,cena_jednotkova,cena_celkova,pocet_kusu) values	(seq_deal.nextval,	1	,	1	,	4	,	3	,	13	,	156	,	12	);	insert into tbl_deal (id,id_order,id_portfolio,id_product,id_type,cena_jednotkova,cena_celkova,pocet_kusu) values	(seq_deal.nextval,	1	,	1	,	1	,	4	,	1	,	-156	,	-156	);
insert into tbl_deal (id,id_order,id_portfolio,id_product,id_type,cena_jednotkova,cena_celkova,pocet_kusu) values	(seq_deal.nextval,	1	,	1	,	4	,	3	,	12	,	120	,	10	);	insert into tbl_deal (id,id_order,id_portfolio,id_product,id_type,cena_jednotkova,cena_celkova,pocet_kusu) values	(seq_deal.nextval,	1	,	1	,	1	,	4	,	1	,	-120	,	-120	);
insert into tbl_deal (id,id_order,id_portfolio,id_product,id_type,cena_jednotkova,cena_celkova,pocet_kusu) values	(seq_deal.nextval,	1	,	1	,	4	,	3	,	10	,	140	,	14	);	insert into tbl_deal (id,id_order,id_portfolio,id_product,id_type,cena_jednotkova,cena_celkova,pocet_kusu) values	(seq_deal.nextval,	1	,	1	,	1	,	4	,	1	,	-140	,	-140	);
insert into tbl_deal (id,id_order,id_portfolio,id_product,id_type,cena_jednotkova,cena_celkova,pocet_kusu) values	(seq_deal.nextval,	1	,	1	,	4	,	3	,	14	,	182	,	13	);	insert into tbl_deal (id,id_order,id_portfolio,id_product,id_type,cena_jednotkova,cena_celkova,pocet_kusu) values	(seq_deal.nextval,	1	,	1	,	1	,	4	,	1	,	-182	,	-182	);
insert into tbl_deal (id,id_order,id_portfolio,id_product,id_type,cena_jednotkova,cena_celkova,pocet_kusu) values	(seq_deal.nextval,	1	,	1	,	5	,	3	,	12	,	132	,	11	);	insert into tbl_deal (id,id_order,id_portfolio,id_product,id_type,cena_jednotkova,cena_celkova,pocet_kusu) values	(seq_deal.nextval,	1	,	1	,	1	,	4	,	1	,	-132	,	-132	);
insert into tbl_deal (id,id_order,id_portfolio,id_product,id_type,cena_jednotkova,cena_celkova,pocet_kusu) values	(seq_deal.nextval,	1	,	1	,	5	,	3	,	12	,	156	,	13	);	insert into tbl_deal (id,id_order,id_portfolio,id_product,id_type,cena_jednotkova,cena_celkova,pocet_kusu) values	(seq_deal.nextval,	1	,	1	,	1	,	4	,	1	,	-156	,	-156	);
insert into tbl_deal (id,id_order,id_portfolio,id_product,id_type,cena_jednotkova,cena_celkova,pocet_kusu) values	(seq_deal.nextval,	1	,	1	,	5	,	3	,	13	,	130	,	10	);	insert into tbl_deal (id,id_order,id_portfolio,id_product,id_type,cena_jednotkova,cena_celkova,pocet_kusu) values	(seq_deal.nextval,	1	,	1	,	1	,	4	,	1	,	-130	,	-130	);
insert into tbl_deal (id,id_order,id_portfolio,id_product,id_type,cena_jednotkova,cena_celkova,pocet_kusu) values	(seq_deal.nextval,	1	,	1	,	5	,	3	,	12	,	156	,	13	);	insert into tbl_deal (id,id_order,id_portfolio,id_product,id_type,cena_jednotkova,cena_celkova,pocet_kusu) values	(seq_deal.nextval,	1	,	1	,	1	,	4	,	1	,	-156	,	-156	);
insert into tbl_deal (id,id_order,id_portfolio,id_product,id_type,cena_jednotkova,cena_celkova,pocet_kusu) values	(seq_deal.nextval,	1	,	1	,	5	,	3	,	12	,	120	,	10	);	insert into tbl_deal (id,id_order,id_portfolio,id_product,id_type,cena_jednotkova,cena_celkova,pocet_kusu) values	(seq_deal.nextval,	1	,	1	,	1	,	4	,	1	,	-120	,	-120	);
insert into tbl_deal (id,id_order,id_portfolio,id_product,id_type,cena_jednotkova,cena_celkova,pocet_kusu) values	(seq_deal.nextval,	1	,	1	,	6	,	3	,	13	,	169	,	13	);	insert into tbl_deal (id,id_order,id_portfolio,id_product,id_type,cena_jednotkova,cena_celkova,pocet_kusu) values	(seq_deal.nextval,	1	,	1	,	1	,	4	,	1	,	-169	,	-169	);
insert into tbl_deal (id,id_order,id_portfolio,id_product,id_type,cena_jednotkova,cena_celkova,pocet_kusu) values	(seq_deal.nextval,	1	,	1	,	6	,	3	,	11	,	121	,	11	);	insert into tbl_deal (id,id_order,id_portfolio,id_product,id_type,cena_jednotkova,cena_celkova,pocet_kusu) values	(seq_deal.nextval,	1	,	1	,	1	,	4	,	1	,	-121	,	-121	);
insert into tbl_deal (id,id_order,id_portfolio,id_product,id_type,cena_jednotkova,cena_celkova,pocet_kusu) values	(seq_deal.nextval,	1	,	1	,	6	,	3	,	12	,	132	,	11	);	insert into tbl_deal (id,id_order,id_portfolio,id_product,id_type,cena_jednotkova,cena_celkova,pocet_kusu) values	(seq_deal.nextval,	1	,	1	,	1	,	4	,	1	,	-132	,	-132	);
insert into tbl_deal (id,id_order,id_portfolio,id_product,id_type,cena_jednotkova,cena_celkova,pocet_kusu) values	(seq_deal.nextval,	1	,	1	,	6	,	3	,	11	,	143	,	13	);	insert into tbl_deal (id,id_order,id_portfolio,id_product,id_type,cena_jednotkova,cena_celkova,pocet_kusu) values	(seq_deal.nextval,	1	,	1	,	1	,	4	,	1	,	-143	,	-143	);
insert into tbl_deal (id,id_order,id_portfolio,id_product,id_type,cena_jednotkova,cena_celkova,pocet_kusu) values	(seq_deal.nextval,	1	,	1	,	6	,	3	,	14	,	140	,	10	);	insert into tbl_deal (id,id_order,id_portfolio,id_product,id_type,cena_jednotkova,cena_celkova,pocet_kusu) values	(seq_deal.nextval,	1	,	1	,	1	,	4	,	1	,	-140	,	-140	);
insert into tbl_deal (id,id_order,id_portfolio,id_product,id_type,cena_jednotkova,cena_celkova,pocet_kusu) values	(seq_deal.nextval,	1	,	1	,	7	,	3	,	13	,	130	,	10	);	insert into tbl_deal (id,id_order,id_portfolio,id_product,id_type,cena_jednotkova,cena_celkova,pocet_kusu) values	(seq_deal.nextval,	1	,	1	,	1	,	4	,	1	,	-130	,	-130	);
insert into tbl_deal (id,id_order,id_portfolio,id_product,id_type,cena_jednotkova,cena_celkova,pocet_kusu) values	(seq_deal.nextval,	1	,	1	,	7	,	3	,	11	,	110	,	10	);	insert into tbl_deal (id,id_order,id_portfolio,id_product,id_type,cena_jednotkova,cena_celkova,pocet_kusu) values	(seq_deal.nextval,	1	,	1	,	1	,	4	,	1	,	-110	,	-110	);
insert into tbl_deal (id,id_order,id_portfolio,id_product,id_type,cena_jednotkova,cena_celkova,pocet_kusu) values	(seq_deal.nextval,	1	,	1	,	7	,	3	,	12	,	132	,	11	);	insert into tbl_deal (id,id_order,id_portfolio,id_product,id_type,cena_jednotkova,cena_celkova,pocet_kusu) values	(seq_deal.nextval,	1	,	1	,	1	,	4	,	1	,	-132	,	-132	);
insert into tbl_deal (id,id_order,id_portfolio,id_product,id_type,cena_jednotkova,cena_celkova,pocet_kusu) values	(seq_deal.nextval,	1	,	1	,	7	,	3	,	11	,	143	,	13	);	insert into tbl_deal (id,id_order,id_portfolio,id_product,id_type,cena_jednotkova,cena_celkova,pocet_kusu) values	(seq_deal.nextval,	1	,	1	,	1	,	4	,	1	,	-143	,	-143	);
insert into tbl_deal (id,id_order,id_portfolio,id_product,id_type,cena_jednotkova,cena_celkova,pocet_kusu) values	(seq_deal.nextval,	1	,	1	,	7	,	3	,	11	,	154	,	14	);	insert into tbl_deal (id,id_order,id_portfolio,id_product,id_type,cena_jednotkova,cena_celkova,pocet_kusu) values	(seq_deal.nextval,	1	,	1	,	1	,	4	,	1	,	-154	,	-154	);
insert into tbl_deal (id,id_order,id_portfolio,id_product,id_type,cena_jednotkova,cena_celkova,pocet_kusu) values	(seq_deal.nextval,	1	,	1	,	8	,	3	,	14	,	168	,	12	);	insert into tbl_deal (id,id_order,id_portfolio,id_product,id_type,cena_jednotkova,cena_celkova,pocet_kusu) values	(seq_deal.nextval,	1	,	1	,	1	,	4	,	1	,	-168	,	-168	);
insert into tbl_deal (id,id_order,id_portfolio,id_product,id_type,cena_jednotkova,cena_celkova,pocet_kusu) values	(seq_deal.nextval,	1	,	1	,	8	,	3	,	11	,	121	,	11	);	insert into tbl_deal (id,id_order,id_portfolio,id_product,id_type,cena_jednotkova,cena_celkova,pocet_kusu) values	(seq_deal.nextval,	1	,	1	,	1	,	4	,	1	,	-121	,	-121	);
insert into tbl_deal (id,id_order,id_portfolio,id_product,id_type,cena_jednotkova,cena_celkova,pocet_kusu) values	(seq_deal.nextval,	1	,	1	,	8	,	3	,	12	,	120	,	10	);	insert into tbl_deal (id,id_order,id_portfolio,id_product,id_type,cena_jednotkova,cena_celkova,pocet_kusu) values	(seq_deal.nextval,	1	,	1	,	1	,	4	,	1	,	-120	,	-120	);
insert into tbl_deal (id,id_order,id_portfolio,id_product,id_type,cena_jednotkova,cena_celkova,pocet_kusu) values	(seq_deal.nextval,	1	,	1	,	8	,	3	,	11	,	132	,	12	);	insert into tbl_deal (id,id_order,id_portfolio,id_product,id_type,cena_jednotkova,cena_celkova,pocet_kusu) values	(seq_deal.nextval,	1	,	1	,	1	,	4	,	1	,	-132	,	-132	);
insert into tbl_deal (id,id_order,id_portfolio,id_product,id_type,cena_jednotkova,cena_celkova,pocet_kusu) values	(seq_deal.nextval,	1	,	1	,	8	,	3	,	12	,	156	,	13	);	insert into tbl_deal (id,id_order,id_portfolio,id_product,id_type,cena_jednotkova,cena_celkova,pocet_kusu) values	(seq_deal.nextval,	1	,	1	,	1	,	4	,	1	,	-156	,	-156	);
insert into tbl_deal (id,id_order,id_portfolio,id_product,id_type,cena_jednotkova,cena_celkova,pocet_kusu) values	(seq_deal.nextval,	1	,	1	,	9	,	3	,	11	,	121	,	11	);	insert into tbl_deal (id,id_order,id_portfolio,id_product,id_type,cena_jednotkova,cena_celkova,pocet_kusu) values	(seq_deal.nextval,	1	,	1	,	1	,	4	,	1	,	-121	,	-121	);
insert into tbl_deal (id,id_order,id_portfolio,id_product,id_type,cena_jednotkova,cena_celkova,pocet_kusu) values	(seq_deal.nextval,	1	,	1	,	9	,	3	,	12	,	168	,	14	);	insert into tbl_deal (id,id_order,id_portfolio,id_product,id_type,cena_jednotkova,cena_celkova,pocet_kusu) values	(seq_deal.nextval,	1	,	1	,	1	,	4	,	1	,	-168	,	-168	);
insert into tbl_deal (id,id_order,id_portfolio,id_product,id_type,cena_jednotkova,cena_celkova,pocet_kusu) values	(seq_deal.nextval,	1	,	1	,	9	,	3	,	12	,	156	,	13	);	insert into tbl_deal (id,id_order,id_portfolio,id_product,id_type,cena_jednotkova,cena_celkova,pocet_kusu) values	(seq_deal.nextval,	1	,	1	,	1	,	4	,	1	,	-156	,	-156	);
insert into tbl_deal (id,id_order,id_portfolio,id_product,id_type,cena_jednotkova,cena_celkova,pocet_kusu) values	(seq_deal.nextval,	1	,	1	,	9	,	3	,	11	,	121	,	11	);	insert into tbl_deal (id,id_order,id_portfolio,id_product,id_type,cena_jednotkova,cena_celkova,pocet_kusu) values	(seq_deal.nextval,	1	,	1	,	1	,	4	,	1	,	-121	,	-121	);
insert into tbl_deal (id,id_order,id_portfolio,id_product,id_type,cena_jednotkova,cena_celkova,pocet_kusu) values	(seq_deal.nextval,	1	,	1	,	9	,	3	,	11	,	132	,	12	);	insert into tbl_deal (id,id_order,id_portfolio,id_product,id_type,cena_jednotkova,cena_celkova,pocet_kusu) values	(seq_deal.nextval,	1	,	1	,	1	,	4	,	1	,	-132	,	-132	);
insert into tbl_deal (id,id_order,id_portfolio,id_product,id_type,cena_jednotkova,cena_celkova,pocet_kusu) values	(seq_deal.nextval,	1	,	1	,	10	,	3	,	14	,	182	,	13	);	insert into tbl_deal (id,id_order,id_portfolio,id_product,id_type,cena_jednotkova,cena_celkova,pocet_kusu) values	(seq_deal.nextval,	1	,	1	,	1	,	4	,	1	,	-182	,	-182	);
insert into tbl_deal (id,id_order,id_portfolio,id_product,id_type,cena_jednotkova,cena_celkova,pocet_kusu) values	(seq_deal.nextval,	1	,	1	,	10	,	3	,	12	,	132	,	11	);	insert into tbl_deal (id,id_order,id_portfolio,id_product,id_type,cena_jednotkova,cena_celkova,pocet_kusu) values	(seq_deal.nextval,	1	,	1	,	1	,	4	,	1	,	-132	,	-132	);
insert into tbl_deal (id,id_order,id_portfolio,id_product,id_type,cena_jednotkova,cena_celkova,pocet_kusu) values	(seq_deal.nextval,	1	,	1	,	10	,	3	,	11	,	121	,	11	);	insert into tbl_deal (id,id_order,id_portfolio,id_product,id_type,cena_jednotkova,cena_celkova,pocet_kusu) values	(seq_deal.nextval,	1	,	1	,	1	,	4	,	1	,	-121	,	-121	);
insert into tbl_deal (id,id_order,id_portfolio,id_product,id_type,cena_jednotkova,cena_celkova,pocet_kusu) values	(seq_deal.nextval,	1	,	1	,	10	,	3	,	13	,	156	,	12	);	insert into tbl_deal (id,id_order,id_portfolio,id_product,id_type,cena_jednotkova,cena_celkova,pocet_kusu) values	(seq_deal.nextval,	1	,	1	,	1	,	4	,	1	,	-156	,	-156	);
insert into tbl_deal (id,id_order,id_portfolio,id_product,id_type,cena_jednotkova,cena_celkova,pocet_kusu) values	(seq_deal.nextval,	1	,	1	,	10	,	3	,	10	,	140	,	14	);	insert into tbl_deal (id,id_order,id_portfolio,id_product,id_type,cena_jednotkova,cena_celkova,pocet_kusu) values	(seq_deal.nextval,	1	,	1	,	1	,	4	,	1	,	-140	,	-140	);
insert into tbl_deal (id,id_order,id_portfolio,id_product,id_type,cena_jednotkova,cena_celkova,pocet_kusu) values	(seq_deal.nextval,	1	,	1	,	11	,	3	,	11	,	121	,	11	);	insert into tbl_deal (id,id_order,id_portfolio,id_product,id_type,cena_jednotkova,cena_celkova,pocet_kusu) values	(seq_deal.nextval,	1	,	1	,	1	,	4	,	1	,	-121	,	-121	);
insert into tbl_deal (id,id_order,id_portfolio,id_product,id_type,cena_jednotkova,cena_celkova,pocet_kusu) values	(seq_deal.nextval,	1	,	1	,	11	,	3	,	11	,	154	,	14	);	insert into tbl_deal (id,id_order,id_portfolio,id_product,id_type,cena_jednotkova,cena_celkova,pocet_kusu) values	(seq_deal.nextval,	1	,	1	,	1	,	4	,	1	,	-154	,	-154	);
insert into tbl_deal (id,id_order,id_portfolio,id_product,id_type,cena_jednotkova,cena_celkova,pocet_kusu) values	(seq_deal.nextval,	1	,	1	,	11	,	3	,	14	,	182	,	13	);	insert into tbl_deal (id,id_order,id_portfolio,id_product,id_type,cena_jednotkova,cena_celkova,pocet_kusu) values	(seq_deal.nextval,	1	,	1	,	1	,	4	,	1	,	-182	,	-182	);
insert into tbl_deal (id,id_order,id_portfolio,id_product,id_type,cena_jednotkova,cena_celkova,pocet_kusu) values	(seq_deal.nextval,	1	,	1	,	11	,	3	,	11	,	121	,	11	);	insert into tbl_deal (id,id_order,id_portfolio,id_product,id_type,cena_jednotkova,cena_celkova,pocet_kusu) values	(seq_deal.nextval,	1	,	1	,	1	,	4	,	1	,	-121	,	-121	);
insert into tbl_deal (id,id_order,id_portfolio,id_product,id_type,cena_jednotkova,cena_celkova,pocet_kusu) values	(seq_deal.nextval,	1	,	1	,	11	,	3	,	10	,	100	,	10	);	insert into tbl_deal (id,id_order,id_portfolio,id_product,id_type,cena_jednotkova,cena_celkova,pocet_kusu) values	(seq_deal.nextval,	1	,	1	,	1	,	4	,	1	,	-100	,	-100	);
insert into tbl_deal (id,id_order,id_portfolio,id_product,id_type,cena_jednotkova,cena_celkova,pocet_kusu) values	(seq_deal.nextval,	1	,	1	,	12	,	3	,	13	,	182	,	14	);	insert into tbl_deal (id,id_order,id_portfolio,id_product,id_type,cena_jednotkova,cena_celkova,pocet_kusu) values	(seq_deal.nextval,	1	,	1	,	1	,	4	,	1	,	-182	,	-182	);
insert into tbl_deal (id,id_order,id_portfolio,id_product,id_type,cena_jednotkova,cena_celkova,pocet_kusu) values	(seq_deal.nextval,	1	,	1	,	12	,	3	,	10	,	140	,	14	);	insert into tbl_deal (id,id_order,id_portfolio,id_product,id_type,cena_jednotkova,cena_celkova,pocet_kusu) values	(seq_deal.nextval,	1	,	1	,	1	,	4	,	1	,	-140	,	-140	);
insert into tbl_deal (id,id_order,id_portfolio,id_product,id_type,cena_jednotkova,cena_celkova,pocet_kusu) values	(seq_deal.nextval,	1	,	1	,	12	,	3	,	13	,	169	,	13	);	insert into tbl_deal (id,id_order,id_portfolio,id_product,id_type,cena_jednotkova,cena_celkova,pocet_kusu) values	(seq_deal.nextval,	1	,	1	,	1	,	4	,	1	,	-169	,	-169	);
insert into tbl_deal (id,id_order,id_portfolio,id_product,id_type,cena_jednotkova,cena_celkova,pocet_kusu) values	(seq_deal.nextval,	1	,	1	,	12	,	3	,	12	,	120	,	10	);	insert into tbl_deal (id,id_order,id_portfolio,id_product,id_type,cena_jednotkova,cena_celkova,pocet_kusu) values	(seq_deal.nextval,	1	,	1	,	1	,	4	,	1	,	-120	,	-120	);
insert into tbl_deal (id,id_order,id_portfolio,id_product,id_type,cena_jednotkova,cena_celkova,pocet_kusu) values	(seq_deal.nextval,	1	,	1	,	12	,	3	,	14	,	196	,	14	);	insert into tbl_deal (id,id_order,id_portfolio,id_product,id_type,cena_jednotkova,cena_celkova,pocet_kusu) values	(seq_deal.nextval,	1	,	1	,	1	,	4	,	1	,	-196	,	-196	);
insert into tbl_deal (id,id_order,id_portfolio,id_product,id_type,cena_jednotkova,cena_celkova,pocet_kusu) values	(seq_deal.nextval,	1	,	1	,	13	,	3	,	13	,	169	,	13	);	insert into tbl_deal (id,id_order,id_portfolio,id_product,id_type,cena_jednotkova,cena_celkova,pocet_kusu) values	(seq_deal.nextval,	1	,	1	,	1	,	4	,	1	,	-169	,	-169	);
insert into tbl_deal (id,id_order,id_portfolio,id_product,id_type,cena_jednotkova,cena_celkova,pocet_kusu) values	(seq_deal.nextval,	1	,	1	,	13	,	3	,	10	,	130	,	13	);	insert into tbl_deal (id,id_order,id_portfolio,id_product,id_type,cena_jednotkova,cena_celkova,pocet_kusu) values	(seq_deal.nextval,	1	,	1	,	1	,	4	,	1	,	-130	,	-130	);
insert into tbl_deal (id,id_order,id_portfolio,id_product,id_type,cena_jednotkova,cena_celkova,pocet_kusu) values	(seq_deal.nextval,	1	,	1	,	13	,	3	,	11	,	143	,	13	);	insert into tbl_deal (id,id_order,id_portfolio,id_product,id_type,cena_jednotkova,cena_celkova,pocet_kusu) values	(seq_deal.nextval,	1	,	1	,	1	,	4	,	1	,	-143	,	-143	);
insert into tbl_deal (id,id_order,id_portfolio,id_product,id_type,cena_jednotkova,cena_celkova,pocet_kusu) values	(seq_deal.nextval,	1	,	1	,	13	,	3	,	14	,	154	,	11	);	insert into tbl_deal (id,id_order,id_portfolio,id_product,id_type,cena_jednotkova,cena_celkova,pocet_kusu) values	(seq_deal.nextval,	1	,	1	,	1	,	4	,	1	,	-154	,	-154	);
insert into tbl_deal (id,id_order,id_portfolio,id_product,id_type,cena_jednotkova,cena_celkova,pocet_kusu) values	(seq_deal.nextval,	1	,	1	,	13	,	3	,	11	,	110	,	10	);	insert into tbl_deal (id,id_order,id_portfolio,id_product,id_type,cena_jednotkova,cena_celkova,pocet_kusu) values	(seq_deal.nextval,	1	,	1	,	1	,	4	,	1	,	-110	,	-110	);
insert into tbl_deal (id,id_order,id_portfolio,id_product,id_type,cena_jednotkova,cena_celkova,pocet_kusu) values	(seq_deal.nextval,	1	,	1	,	14	,	3	,	10	,	120	,	12	);	insert into tbl_deal (id,id_order,id_portfolio,id_product,id_type,cena_jednotkova,cena_celkova,pocet_kusu) values	(seq_deal.nextval,	1	,	1	,	1	,	4	,	1	,	-120	,	-120	);
insert into tbl_deal (id,id_order,id_portfolio,id_product,id_type,cena_jednotkova,cena_celkova,pocet_kusu) values	(seq_deal.nextval,	1	,	1	,	14	,	3	,	13	,	130	,	10	);	insert into tbl_deal (id,id_order,id_portfolio,id_product,id_type,cena_jednotkova,cena_celkova,pocet_kusu) values	(seq_deal.nextval,	1	,	1	,	1	,	4	,	1	,	-130	,	-130	);
insert into tbl_deal (id,id_order,id_portfolio,id_product,id_type,cena_jednotkova,cena_celkova,pocet_kusu) values	(seq_deal.nextval,	1	,	1	,	14	,	3	,	11	,	110	,	10	);	insert into tbl_deal (id,id_order,id_portfolio,id_product,id_type,cena_jednotkova,cena_celkova,pocet_kusu) values	(seq_deal.nextval,	1	,	1	,	1	,	4	,	1	,	-110	,	-110	);
insert into tbl_deal (id,id_order,id_portfolio,id_product,id_type,cena_jednotkova,cena_celkova,pocet_kusu) values	(seq_deal.nextval,	1	,	1	,	14	,	3	,	14	,	196	,	14	);	insert into tbl_deal (id,id_order,id_portfolio,id_product,id_type,cena_jednotkova,cena_celkova,pocet_kusu) values	(seq_deal.nextval,	1	,	1	,	1	,	4	,	1	,	-196	,	-196	);
insert into tbl_deal (id,id_order,id_portfolio,id_product,id_type,cena_jednotkova,cena_celkova,pocet_kusu) values	(seq_deal.nextval,	1	,	1	,	14	,	3	,	12	,	156	,	13	);	insert into tbl_deal (id,id_order,id_portfolio,id_product,id_type,cena_jednotkova,cena_celkova,pocet_kusu) values	(seq_deal.nextval,	1	,	1	,	1	,	4	,	1	,	-156	,	-156	);
insert into tbl_deal (id,id_order,id_portfolio,id_product,id_type,cena_jednotkova,cena_celkova,pocet_kusu) values	(seq_deal.nextval,	1	,	1	,	15	,	3	,	13	,	156	,	12	);	insert into tbl_deal (id,id_order,id_portfolio,id_product,id_type,cena_jednotkova,cena_celkova,pocet_kusu) values	(seq_deal.nextval,	1	,	1	,	1	,	4	,	1	,	-156	,	-156	);
insert into tbl_deal (id,id_order,id_portfolio,id_product,id_type,cena_jednotkova,cena_celkova,pocet_kusu) values	(seq_deal.nextval,	1	,	1	,	15	,	3	,	13	,	156	,	12	);	insert into tbl_deal (id,id_order,id_portfolio,id_product,id_type,cena_jednotkova,cena_celkova,pocet_kusu) values	(seq_deal.nextval,	1	,	1	,	1	,	4	,	1	,	-156	,	-156	);
insert into tbl_deal (id,id_order,id_portfolio,id_product,id_type,cena_jednotkova,cena_celkova,pocet_kusu) values	(seq_deal.nextval,	1	,	1	,	15	,	3	,	13	,	169	,	13	);	insert into tbl_deal (id,id_order,id_portfolio,id_product,id_type,cena_jednotkova,cena_celkova,pocet_kusu) values	(seq_deal.nextval,	1	,	1	,	1	,	4	,	1	,	-169	,	-169	);
insert into tbl_deal (id,id_order,id_portfolio,id_product,id_type,cena_jednotkova,cena_celkova,pocet_kusu) values	(seq_deal.nextval,	1	,	1	,	15	,	3	,	13	,	169	,	13	);	insert into tbl_deal (id,id_order,id_portfolio,id_product,id_type,cena_jednotkova,cena_celkova,pocet_kusu) values	(seq_deal.nextval,	1	,	1	,	1	,	4	,	1	,	-169	,	-169	);
insert into tbl_deal (id,id_order,id_portfolio,id_product,id_type,cena_jednotkova,cena_celkova,pocet_kusu) values	(seq_deal.nextval,	1	,	1	,	15	,	3	,	13	,	182	,	14	);	insert into tbl_deal (id,id_order,id_portfolio,id_product,id_type,cena_jednotkova,cena_celkova,pocet_kusu) values	(seq_deal.nextval,	1	,	1	,	1	,	4	,	1	,	-182	,	-182	);
insert into tbl_deal (id,id_order,id_portfolio,id_product,id_type,cena_jednotkova,cena_celkova,pocet_kusu) values	(seq_deal.nextval,	1	,	1	,	16	,	3	,	12	,	120	,	10	);	insert into tbl_deal (id,id_order,id_portfolio,id_product,id_type,cena_jednotkova,cena_celkova,pocet_kusu) values	(seq_deal.nextval,	1	,	1	,	1	,	4	,	1	,	-120	,	-120	);
insert into tbl_deal (id,id_order,id_portfolio,id_product,id_type,cena_jednotkova,cena_celkova,pocet_kusu) values	(seq_deal.nextval,	1	,	1	,	16	,	3	,	11	,	143	,	13	);	insert into tbl_deal (id,id_order,id_portfolio,id_product,id_type,cena_jednotkova,cena_celkova,pocet_kusu) values	(seq_deal.nextval,	1	,	1	,	1	,	4	,	1	,	-143	,	-143	);
insert into tbl_deal (id,id_order,id_portfolio,id_product,id_type,cena_jednotkova,cena_celkova,pocet_kusu) values	(seq_deal.nextval,	1	,	1	,	16	,	3	,	14	,	154	,	11	);	insert into tbl_deal (id,id_order,id_portfolio,id_product,id_type,cena_jednotkova,cena_celkova,pocet_kusu) values	(seq_deal.nextval,	1	,	1	,	1	,	4	,	1	,	-154	,	-154	);
insert into tbl_deal (id,id_order,id_portfolio,id_product,id_type,cena_jednotkova,cena_celkova,pocet_kusu) values	(seq_deal.nextval,	1	,	1	,	16	,	3	,	14	,	196	,	14	);	insert into tbl_deal (id,id_order,id_portfolio,id_product,id_type,cena_jednotkova,cena_celkova,pocet_kusu) values	(seq_deal.nextval,	1	,	1	,	1	,	4	,	1	,	-196	,	-196	);
insert into tbl_deal (id,id_order,id_portfolio,id_product,id_type,cena_jednotkova,cena_celkova,pocet_kusu) values	(seq_deal.nextval,	1	,	1	,	16	,	3	,	11	,	121	,	11	);	insert into tbl_deal (id,id_order,id_portfolio,id_product,id_type,cena_jednotkova,cena_celkova,pocet_kusu) values	(seq_deal.nextval,	1	,	1	,	1	,	4	,	1	,	-121	,	-121	);
insert into tbl_deal (id,id_order,id_portfolio,id_product,id_type,cena_jednotkova,cena_celkova,pocet_kusu) values	(seq_deal.nextval,	1	,	1	,	17	,	3	,	13	,	156	,	12	);	insert into tbl_deal (id,id_order,id_portfolio,id_product,id_type,cena_jednotkova,cena_celkova,pocet_kusu) values	(seq_deal.nextval,	1	,	1	,	1	,	4	,	1	,	-156	,	-156	);
insert into tbl_deal (id,id_order,id_portfolio,id_product,id_type,cena_jednotkova,cena_celkova,pocet_kusu) values	(seq_deal.nextval,	1	,	1	,	17	,	3	,	12	,	144	,	12	);	insert into tbl_deal (id,id_order,id_portfolio,id_product,id_type,cena_jednotkova,cena_celkova,pocet_kusu) values	(seq_deal.nextval,	1	,	1	,	1	,	4	,	1	,	-144	,	-144	);
insert into tbl_deal (id,id_order,id_portfolio,id_product,id_type,cena_jednotkova,cena_celkova,pocet_kusu) values	(seq_deal.nextval,	1	,	1	,	17	,	3	,	10	,	110	,	11	);	insert into tbl_deal (id,id_order,id_portfolio,id_product,id_type,cena_jednotkova,cena_celkova,pocet_kusu) values	(seq_deal.nextval,	1	,	1	,	1	,	4	,	1	,	-110	,	-110	);
insert into tbl_deal (id,id_order,id_portfolio,id_product,id_type,cena_jednotkova,cena_celkova,pocet_kusu) values	(seq_deal.nextval,	1	,	1	,	17	,	3	,	10	,	110	,	11	);	insert into tbl_deal (id,id_order,id_portfolio,id_product,id_type,cena_jednotkova,cena_celkova,pocet_kusu) values	(seq_deal.nextval,	1	,	1	,	1	,	4	,	1	,	-110	,	-110	);
insert into tbl_deal (id,id_order,id_portfolio,id_product,id_type,cena_jednotkova,cena_celkova,pocet_kusu) values	(seq_deal.nextval,	1	,	1	,	17	,	3	,	10	,	100	,	10	);	insert into tbl_deal (id,id_order,id_portfolio,id_product,id_type,cena_jednotkova,cena_celkova,pocet_kusu) values	(seq_deal.nextval,	1	,	1	,	1	,	4	,	1	,	-100	,	-100	);
insert into tbl_deal (id,id_order,id_portfolio,id_product,id_type,cena_jednotkova,cena_celkova,pocet_kusu) values	(seq_deal.nextval,	1	,	1	,	18	,	3	,	10	,	100	,	10	);	insert into tbl_deal (id,id_order,id_portfolio,id_product,id_type,cena_jednotkova,cena_celkova,pocet_kusu) values	(seq_deal.nextval,	1	,	1	,	1	,	4	,	1	,	-100	,	-100	);
insert into tbl_deal (id,id_order,id_portfolio,id_product,id_type,cena_jednotkova,cena_celkova,pocet_kusu) values	(seq_deal.nextval,	1	,	1	,	18	,	3	,	13	,	156	,	12	);	insert into tbl_deal (id,id_order,id_portfolio,id_product,id_type,cena_jednotkova,cena_celkova,pocet_kusu) values	(seq_deal.nextval,	1	,	1	,	1	,	4	,	1	,	-156	,	-156	);
insert into tbl_deal (id,id_order,id_portfolio,id_product,id_type,cena_jednotkova,cena_celkova,pocet_kusu) values	(seq_deal.nextval,	1	,	1	,	18	,	3	,	13	,	143	,	11	);	insert into tbl_deal (id,id_order,id_portfolio,id_product,id_type,cena_jednotkova,cena_celkova,pocet_kusu) values	(seq_deal.nextval,	1	,	1	,	1	,	4	,	1	,	-143	,	-143	);
insert into tbl_deal (id,id_order,id_portfolio,id_product,id_type,cena_jednotkova,cena_celkova,pocet_kusu) values	(seq_deal.nextval,	1	,	1	,	18	,	3	,	12	,	156	,	13	);	insert into tbl_deal (id,id_order,id_portfolio,id_product,id_type,cena_jednotkova,cena_celkova,pocet_kusu) values	(seq_deal.nextval,	1	,	1	,	1	,	4	,	1	,	-156	,	-156	);
insert into tbl_deal (id,id_order,id_portfolio,id_product,id_type,cena_jednotkova,cena_celkova,pocet_kusu) values	(seq_deal.nextval,	1	,	1	,	18	,	3	,	12	,	132	,	11	);	insert into tbl_deal (id,id_order,id_portfolio,id_product,id_type,cena_jednotkova,cena_celkova,pocet_kusu) values	(seq_deal.nextval,	1	,	1	,	1	,	4	,	1	,	-132	,	-132	);
insert into tbl_deal (id,id_order,id_portfolio,id_product,id_type,cena_jednotkova,cena_celkova,pocet_kusu) values	(seq_deal.nextval,	1	,	1	,	19	,	3	,	12	,	132	,	11	);	insert into tbl_deal (id,id_order,id_portfolio,id_product,id_type,cena_jednotkova,cena_celkova,pocet_kusu) values	(seq_deal.nextval,	1	,	1	,	1	,	4	,	1	,	-132	,	-132	);
insert into tbl_deal (id,id_order,id_portfolio,id_product,id_type,cena_jednotkova,cena_celkova,pocet_kusu) values	(seq_deal.nextval,	1	,	1	,	19	,	3	,	10	,	100	,	10	);	insert into tbl_deal (id,id_order,id_portfolio,id_product,id_type,cena_jednotkova,cena_celkova,pocet_kusu) values	(seq_deal.nextval,	1	,	1	,	1	,	4	,	1	,	-100	,	-100	);
insert into tbl_deal (id,id_order,id_portfolio,id_product,id_type,cena_jednotkova,cena_celkova,pocet_kusu) values	(seq_deal.nextval,	1	,	1	,	19	,	3	,	14	,	168	,	12	);	insert into tbl_deal (id,id_order,id_portfolio,id_product,id_type,cena_jednotkova,cena_celkova,pocet_kusu) values	(seq_deal.nextval,	1	,	1	,	1	,	4	,	1	,	-168	,	-168	);
insert into tbl_deal (id,id_order,id_portfolio,id_product,id_type,cena_jednotkova,cena_celkova,pocet_kusu) values	(seq_deal.nextval,	1	,	1	,	19	,	3	,	12	,	120	,	10	);	insert into tbl_deal (id,id_order,id_portfolio,id_product,id_type,cena_jednotkova,cena_celkova,pocet_kusu) values	(seq_deal.nextval,	1	,	1	,	1	,	4	,	1	,	-120	,	-120	);
insert into tbl_deal (id,id_order,id_portfolio,id_product,id_type,cena_jednotkova,cena_celkova,pocet_kusu) values	(seq_deal.nextval,	1	,	1	,	19	,	3	,	10	,	120	,	12	);	insert into tbl_deal (id,id_order,id_portfolio,id_product,id_type,cena_jednotkova,cena_celkova,pocet_kusu) values	(seq_deal.nextval,	1	,	1	,	1	,	4	,	1	,	-120	,	-120	);
insert into tbl_deal (id,id_order,id_portfolio,id_product,id_type,cena_jednotkova,cena_celkova,pocet_kusu) values	(seq_deal.nextval,	1	,	1	,	20	,	3	,	12	,	120	,	10	);	insert into tbl_deal (id,id_order,id_portfolio,id_product,id_type,cena_jednotkova,cena_celkova,pocet_kusu) values	(seq_deal.nextval,	1	,	1	,	1	,	4	,	1	,	-120	,	-120	);
insert into tbl_deal (id,id_order,id_portfolio,id_product,id_type,cena_jednotkova,cena_celkova,pocet_kusu) values	(seq_deal.nextval,	1	,	1	,	20	,	3	,	12	,	144	,	12	);	insert into tbl_deal (id,id_order,id_portfolio,id_product,id_type,cena_jednotkova,cena_celkova,pocet_kusu) values	(seq_deal.nextval,	1	,	1	,	1	,	4	,	1	,	-144	,	-144	);
insert into tbl_deal (id,id_order,id_portfolio,id_product,id_type,cena_jednotkova,cena_celkova,pocet_kusu) values	(seq_deal.nextval,	1	,	1	,	20	,	3	,	14	,	154	,	11	);	insert into tbl_deal (id,id_order,id_portfolio,id_product,id_type,cena_jednotkova,cena_celkova,pocet_kusu) values	(seq_deal.nextval,	1	,	1	,	1	,	4	,	1	,	-154	,	-154	);
insert into tbl_deal (id,id_order,id_portfolio,id_product,id_type,cena_jednotkova,cena_celkova,pocet_kusu) values	(seq_deal.nextval,	1	,	1	,	20	,	3	,	14	,	182	,	13	);	insert into tbl_deal (id,id_order,id_portfolio,id_product,id_type,cena_jednotkova,cena_celkova,pocet_kusu) values	(seq_deal.nextval,	1	,	1	,	1	,	4	,	1	,	-182	,	-182	);
insert into tbl_deal (id,id_order,id_portfolio,id_product,id_type,cena_jednotkova,cena_celkova,pocet_kusu) values	(seq_deal.nextval,	1	,	1	,	20	,	3	,	14	,	168	,	12	);	insert into tbl_deal (id,id_order,id_portfolio,id_product,id_type,cena_jednotkova,cena_celkova,pocet_kusu) values	(seq_deal.nextval,	1	,	1	,	1	,	4	,	1	,	-168	,	-168	);
insert into tbl_deal (id,id_order,id_portfolio,id_product,id_type,cena_jednotkova,cena_celkova,pocet_kusu) values	(seq_deal.nextval,	1	,	1	,	21	,	3	,	12	,	156	,	13	);	insert into tbl_deal (id,id_order,id_portfolio,id_product,id_type,cena_jednotkova,cena_celkova,pocet_kusu) values	(seq_deal.nextval,	1	,	1	,	1	,	4	,	1	,	-156	,	-156	);
insert into tbl_deal (id,id_order,id_portfolio,id_product,id_type,cena_jednotkova,cena_celkova,pocet_kusu) values	(seq_deal.nextval,	1	,	1	,	21	,	3	,	13	,	143	,	11	);	insert into tbl_deal (id,id_order,id_portfolio,id_product,id_type,cena_jednotkova,cena_celkova,pocet_kusu) values	(seq_deal.nextval,	1	,	1	,	1	,	4	,	1	,	-143	,	-143	);
insert into tbl_deal (id,id_order,id_portfolio,id_product,id_type,cena_jednotkova,cena_celkova,pocet_kusu) values	(seq_deal.nextval,	1	,	1	,	21	,	3	,	10	,	100	,	10	);	insert into tbl_deal (id,id_order,id_portfolio,id_product,id_type,cena_jednotkova,cena_celkova,pocet_kusu) values	(seq_deal.nextval,	1	,	1	,	1	,	4	,	1	,	-100	,	-100	);
insert into tbl_deal (id,id_order,id_portfolio,id_product,id_type,cena_jednotkova,cena_celkova,pocet_kusu) values	(seq_deal.nextval,	1	,	1	,	21	,	3	,	14	,	140	,	10	);	insert into tbl_deal (id,id_order,id_portfolio,id_product,id_type,cena_jednotkova,cena_celkova,pocet_kusu) values	(seq_deal.nextval,	1	,	1	,	1	,	4	,	1	,	-140	,	-140	);
insert into tbl_deal (id,id_order,id_portfolio,id_product,id_type,cena_jednotkova,cena_celkova,pocet_kusu) values	(seq_deal.nextval,	1	,	1	,	21	,	3	,	11	,	110	,	10	);	insert into tbl_deal (id,id_order,id_portfolio,id_product,id_type,cena_jednotkova,cena_celkova,pocet_kusu) values	(seq_deal.nextval,	1	,	1	,	1	,	4	,	1	,	-110	,	-110	);
insert into tbl_deal (id,id_order,id_portfolio,id_product,id_type,cena_jednotkova,cena_celkova,pocet_kusu) values	(seq_deal.nextval,	1	,	1	,	22	,	3	,	14	,	168	,	12	);	insert into tbl_deal (id,id_order,id_portfolio,id_product,id_type,cena_jednotkova,cena_celkova,pocet_kusu) values	(seq_deal.nextval,	1	,	1	,	1	,	4	,	1	,	-168	,	-168	);
insert into tbl_deal (id,id_order,id_portfolio,id_product,id_type,cena_jednotkova,cena_celkova,pocet_kusu) values	(seq_deal.nextval,	1	,	1	,	22	,	3	,	13	,	130	,	10	);	insert into tbl_deal (id,id_order,id_portfolio,id_product,id_type,cena_jednotkova,cena_celkova,pocet_kusu) values	(seq_deal.nextval,	1	,	1	,	1	,	4	,	1	,	-130	,	-130	);
insert into tbl_deal (id,id_order,id_portfolio,id_product,id_type,cena_jednotkova,cena_celkova,pocet_kusu) values	(seq_deal.nextval,	1	,	1	,	22	,	3	,	11	,	121	,	11	);	insert into tbl_deal (id,id_order,id_portfolio,id_product,id_type,cena_jednotkova,cena_celkova,pocet_kusu) values	(seq_deal.nextval,	1	,	1	,	1	,	4	,	1	,	-121	,	-121	);
insert into tbl_deal (id,id_order,id_portfolio,id_product,id_type,cena_jednotkova,cena_celkova,pocet_kusu) values	(seq_deal.nextval,	1	,	1	,	22	,	3	,	13	,	182	,	14	);	insert into tbl_deal (id,id_order,id_portfolio,id_product,id_type,cena_jednotkova,cena_celkova,pocet_kusu) values	(seq_deal.nextval,	1	,	1	,	1	,	4	,	1	,	-182	,	-182	);
insert into tbl_deal (id,id_order,id_portfolio,id_product,id_type,cena_jednotkova,cena_celkova,pocet_kusu) values	(seq_deal.nextval,	1	,	1	,	22	,	3	,	14	,	196	,	14	);	insert into tbl_deal (id,id_order,id_portfolio,id_product,id_type,cena_jednotkova,cena_celkova,pocet_kusu) values	(seq_deal.nextval,	1	,	1	,	1	,	4	,	1	,	-196	,	-196	);
insert into tbl_deal (id,id_order,id_portfolio,id_product,id_type,cena_jednotkova,cena_celkova,pocet_kusu) values	(seq_deal.nextval,	1	,	1	,	23	,	3	,	10	,	100	,	10	);	insert into tbl_deal (id,id_order,id_portfolio,id_product,id_type,cena_jednotkova,cena_celkova,pocet_kusu) values	(seq_deal.nextval,	1	,	1	,	1	,	4	,	1	,	-100	,	-100	);
insert into tbl_deal (id,id_order,id_portfolio,id_product,id_type,cena_jednotkova,cena_celkova,pocet_kusu) values	(seq_deal.nextval,	1	,	1	,	23	,	3	,	13	,	156	,	12	);	insert into tbl_deal (id,id_order,id_portfolio,id_product,id_type,cena_jednotkova,cena_celkova,pocet_kusu) values	(seq_deal.nextval,	1	,	1	,	1	,	4	,	1	,	-156	,	-156	);
insert into tbl_deal (id,id_order,id_portfolio,id_product,id_type,cena_jednotkova,cena_celkova,pocet_kusu) values	(seq_deal.nextval,	1	,	1	,	23	,	3	,	10	,	100	,	10	);	insert into tbl_deal (id,id_order,id_portfolio,id_product,id_type,cena_jednotkova,cena_celkova,pocet_kusu) values	(seq_deal.nextval,	1	,	1	,	1	,	4	,	1	,	-100	,	-100	);
insert into tbl_deal (id,id_order,id_portfolio,id_product,id_type,cena_jednotkova,cena_celkova,pocet_kusu) values	(seq_deal.nextval,	1	,	1	,	23	,	3	,	11	,	143	,	13	);	insert into tbl_deal (id,id_order,id_portfolio,id_product,id_type,cena_jednotkova,cena_celkova,pocet_kusu) values	(seq_deal.nextval,	1	,	1	,	1	,	4	,	1	,	-143	,	-143	);
